,Name,Text,Time
366,Alexandria Ocasio-Cortez,"RT @JStein_WaPo: So ... Looks like a bunch of vulnerable House Rs are going to have just voted for 30% cuts to hundreds of domestic programs ... only for the bill to fail anyway by a wide margin? 

(And even if the bill had passed the House it would still be DOA anyway in the Senate) https://t.co/A3SH28ohXE",2023-09-29 20:43:57+00:00
367,Jeff Stein,"So ... Looks like a bunch of vulnerable House Rs are going to have just voted for 30% cuts to hundreds of domestic programs ... only for the bill to fail anyway by a wide margin? 

(And even if the bill had passed the House it would still be DOA anyway in the Senate) https://t.co/A3SH28ohXE",2023-09-29 17:51:57+00:00
368,Jeff Stein,"House GOP will try today advance bill that cuts by at least 30%:
- Housing subsidies 4 poor
- Medical research 4 cancer etc
- SSA offices
- Nutrition aid 4 pregnant moms
- Head Start
- EPA
- NASA
- Justice Dept
- LIHEAP
- Toxic waste cleanup
- &amp; much more

(Exempts DHS, VA, DOD)",2023-09-29 16:17:18+00:00
369,Alexandria Ocasio-Cortez,RT @WhiteHouse: So close! The government actually needs to be funded 100% to stay open. Hope this helps.,2023-09-29 19:58:45+00:00
370,The White House,So close! The government actually needs to be funded 100% to stay open. Hope this helps.,2023-09-29 18:47:00+00:00
371,Kevin McCarthy,"The Republican House has already done what many in the media said was impossible—we voted to fund more than 70% of government spending. To date, the Senate has done zero.

Join me live in a few minutes with @RepMarkGreen, @RepMonicaDLC, and @RepDesposito 
https://t.co/vmn31INPH5",2023-09-29 13:59:50+00:00
372,Alexandria Ocasio-Cortez,"RT @GovKathyHochul: I am declaring a State of Emergency across New York City, Long Island, and the Hudson Valley due to the extreme rainfall we’re seeing throughout the region. 

Please take steps to stay safe and remember to never attempt to travel on flooded roads.",2023-09-29 16:32:58+00:00
373,Governor Kathy Hochul,"I am declaring a State of Emergency across New York City, Long Island, and the Hudson Valley due to the extreme rainfall we’re seeing throughout the region. 

Please take steps to stay safe and remember to never attempt to travel on flooded roads.",2023-09-29 14:11:43+00:00
374,Alexandria Ocasio-Cortez,"Dianne Feinstein was a history-maker who paved the way for women leaders in this country.

She dedicated her life to public service, including saving countless American lives with her work on gun safety and many other issues.

Today we hold up her memory and keep her family in our prayers.",2023-09-29 15:16:00+00:00
375,NBC News,"BREAKING: Sen. Dianne Feinstein, a trailblazer in U.S. politics and the longest-serving woman in the Senate, has died at 90. 

https://t.co/NFExqhBvMZ https://t.co/pEHAANiGyU",2023-09-29 12:48:00+00:00
376,Alexandria Ocasio-Cortez,"RT @allinwithchris: .@RepAOC on the Republican-led impeachment hearing: ""I am quite not really sure why they decided to embarrass themselves in this manner today."" https://t.co/dqDiok8VmI",2023-09-29 04:04:23+00:00
377,All In with Chris Hayes,".@RepAOC on the Republican-led impeachment hearing: ""I am quite not really sure why they decided to embarrass themselves in this manner today."" https://t.co/dqDiok8VmI",2023-09-29 00:33:38+00:00
378,Alexandria Ocasio-Cortez,The Republican impeachment hearing today was so bad I think they asked ChatGPT to write their questions with no fact checks,2023-09-29 01:30:56+00:00
379,Aaron Rupar,"AOC on MSNBC: ""It really cannot be understated how deceptive that was -- to take critical messages out of context, to tear apart the context that they're in, and then to photoshop a text message bubble ... and this is supposed to be the Republican case for impeachment?"" https://t.co/AJUgqrEC1F",2023-09-29 00:36:30+00:00
380,Alexandria Ocasio-Cortez,"Presenting: Team AOC's 2022 Unwrapped! 🎁

Ever wonder what your Representative has been up to? We're proud to share our annual report to constituents and supporters across the country!

Here's our 22 Wins for 2022🏆
Want to help for 2023? Share + sign up: https://t.co/0o7guZ7Hbm https://t.co/ucb6Hcd6Ai",2022-12-21 18:18:34+00:00
381,Alexandria Ocasio-Cortez,"What’s funny about this photo?

The House is holding important votes in DC tonight, people are scrambling to avoid a shutdown, but this Republican Congressman decided to skip town to joyride with a billionaire when his own party has just a single-digit margin and needs his vote.",2023-09-29 00:09:52+00:00
382,Griff Jenkins,BREAKING: @elonmusk is on the ground in Eagle Pass with @RepTonyGonzales to see the migrant crisis for himself… @FoxNews https://t.co/V0IszSKdzn,2023-09-28 22:21:12+00:00
383,Alexandria Ocasio-Cortez,"RT @AdamSchiff: Elon Musk just fired half of the Election Integrity Team at X.

Allowing election misinformation to fester on this platform opens our democracy up to further attack and disinformation.

But Elon seems fine with that.",2023-09-28 23:24:10+00:00
384,Adam Schiff,"Elon Musk just fired half of the Election Integrity Team at X.

Allowing election misinformation to fester on this platform opens our democracy up to further attack and disinformation.

But Elon seems fine with that.",2023-09-28 22:23:15+00:00
385,Alexandria Ocasio-Cortez,"RT @Acyn: AOC: Mr. Turley, simple question for you. In your testimony today, are you presenting any first-hand witness account of crimes committed by the president of the United States? 

Turley: No, I'm not. https://t.co/nuevF8Nn7N",2023-09-28 18:30:24+00:00
386,Acyn,"AOC: Mr. Turley, simple question for you. In your testimony today, are you presenting any first-hand witness account of crimes committed by the president of the United States? 

Turley: No, I'm not. https://t.co/nuevF8Nn7N",2023-09-28 16:37:22+00:00
387,Alexandria Ocasio-Cortez,"RT @BidenHQ: All three Republican witnesses are asked if they have any firsthand knowledge of wrongdoing, they all say no https://t.co/UXXUD39XAT",2023-09-28 17:36:24+00:00
388,Biden-Harris HQ,"All three Republican witnesses are asked if they have any firsthand knowledge of wrongdoing, they all say no https://t.co/UXXUD39XAT",2023-09-28 17:21:43+00:00
389,Alexandria Ocasio-Cortez,"RT @atrupar: AOC uses her questioning time to highlight that none of the ""witnesses"" are actually, you know, witnesses of anything. Meanwhile, Republicans block the testimony of actual witnesses like Giuliani and Parnas. https://t.co/TZlZ7CcGet",2023-09-28 17:09:54+00:00
390,Aaron Rupar,"AOC uses her questioning time to highlight that none of the ""witnesses"" are actually, you know, witnesses of anything. Meanwhile, Republicans block the testimony of actual witnesses like Giuliani and Parnas. https://t.co/TZlZ7CcGet",2023-09-28 16:39:11+00:00
391,Alexandria Ocasio-Cortez,"RT @Acyn: AOC: That screenshot of what appeared to be a text message was a fabricated image. It was a fabricated image, I don't know where it came from, I don't know if it was staff of the committee, https://t.co/Hv6s9oii3a",2023-09-28 17:03:05+00:00
392,Acyn,"AOC: That screenshot of what appeared to be a text message was a fabricated image. It was a fabricated image, I don't know where it came from, I don't know if it was staff of the committee, https://t.co/Hv6s9oii3a",2023-09-28 16:41:07+00:00
393,Alexandria Ocasio-Cortez,RT @Acyn: This is a great example of how prepared Democrats on the House Oversight Committee are https://t.co/5MJcqOkk5X,2023-09-28 16:58:40+00:00
394,Acyn,This is a great example of how prepared Democrats on the House Oversight Committee are https://t.co/5MJcqOkk5X,2023-09-28 14:45:55+00:00
395,Alexandria Ocasio-Cortez,"It’s disgusting, misogynistic, and if Republicans want to continue pissing off an entire nation of women, please be my guest.

We’ll see you at the ballot box. 🗳️🔥",2023-09-28 02:23:29+00:00
396,Tommy Vietor,"Christie referring to Biden as ""sleeping with a member of the teacher's union"" is gross and disrespectful",2023-09-28 02:03:43+00:00
397,Alexandria Ocasio-Cortez,"RT @SawyerHackett: “I favor ending birthright citizenship,” said man born in the U.S. to two noncitizens, making him a birthright citizen. https://t.co/mUe1WgK6j5",2023-09-28 02:18:57+00:00
398,Sawyer Hackett,"“I favor ending birthright citizenship,” said man born in the U.S. to two noncitizens, making him a birthright citizen. https://t.co/mUe1WgK6j5",2023-09-28 01:42:03+00:00
399,Alexandria Ocasio-Cortez,"Mike Pence was Vice President of the United States and still doesn’t know how a bill becomes a law, apparently",2023-09-28 01:14:08+00:00
400,Ryan Grim,"Mike Pence argues we should “repeal the Green New Deal.” 

Impressive to just skip the step of passing it and going straight to repeal.",2023-09-28 01:12:27+00:00
401,Alexandria Ocasio-Cortez,"Solidarity IS the strategy.

As we overcome division and bigotry, we will win economic dignity for all.

The people stand with @UAW 🇺🇸 
https://t.co/tc6mSa77Ht",2023-09-28 00:03:15+00:00
402,Alexandria Ocasio-Cortez,"RT @MorePerfectUS: When @AOC went to speak to striking UAW workers, the message was clear: “Solidarity is the strategy. Us sticking together breaks up their approach. They don't know what to do when people are unified.” https://t.co/kF6AV7LZHD",2023-09-27 22:22:05+00:00
403,More Perfect Union,"When @AOC went to speak to striking UAW workers, the message was clear: “Solidarity is the strategy. Us sticking together breaks up their approach. They don't know what to do when people are unified.” https://t.co/kF6AV7LZHD",2023-09-27 19:19:43+00:00
404,Alexandria Ocasio-Cortez,Could you imagine if Congress were 72% women and regularly spent their time debating what they should or shouldn’t allow men to do 💀,2023-09-27 19:16:31+00:00
405,Acyn,"Good: Instead of making it easier for women to get access to an abortion pill, the FDA should be banning it https://t.co/bkNvxMMDmn",2023-09-27 06:48:55+00:00
406,Alexandria Ocasio-Cortez,Seems absurd but the reverse is our everyday reality! 🙃,2023-09-27 19:17:05+00:00
407,Alexandria Ocasio-Cortez,"RT @jul1arock: New report from @rooseveltinst and @iteptweets finds that Roberts &amp; Alito own shares in 19 companies that could see combined tax relief of more than $30 billion if the court issues a broad ruling in the Moore v. United States case it is hearing next term.

https://t.co/rdYLkGgkYY",2023-09-27 18:41:42+00:00
408,Julia Rock,"New report from @rooseveltinst and @iteptweets finds that Roberts &amp; Alito own shares in 19 companies that could see combined tax relief of more than $30 billion if the court issues a broad ruling in the Moore v. United States case it is hearing next term.

https://t.co/rdYLkGgkYY",2023-09-27 12:28:03+00:00
409,Alexandria Ocasio-Cortez,RT @RepAOC: Republicans have no solutions for immigration. https://t.co/n4FmslAiRq,2023-09-27 18:23:39+00:00
410,Rep. Alexandria Ocasio-Cortez,Republicans have no solutions for immigration. https://t.co/n4FmslAiRq,2023-09-27 18:19:37+00:00
411,Alexandria Ocasio-Cortez,"RT @SenWhitehouse: HUGE bipartisan Senate vote last night opens a well-lit offramp for Speaker McCarthy on his careening path toward shutdown. Any shutdown will now be his political choice, and will reflect MAGA extremist dominance over him.",2023-09-27 15:57:59+00:00
412,Sheldon Whitehouse,"HUGE bipartisan Senate vote last night opens a well-lit offramp for Speaker McCarthy on his careening path toward shutdown. Any shutdown will now be his political choice, and will reflect MAGA extremist dominance over him.",2023-09-27 15:12:09+00:00
413,Alexandria Ocasio-Cortez,"A clean measure to keep the government open likely has enough votes to pass both the House + Senate, and keep huge swaths of American workers paid and their lives undisrupted as GOP sort out their political differences.

The Republican Speaker is blocking it from getting a vote.",2023-09-27 14:50:19+00:00
414,Erik Wasson,MCCARTHY TOLD GOP HE WON'T ALLOW VOTE ON SENATE STOPGAP: BOB GOOD,2023-09-27 14:08:21+00:00
415,Alexandria Ocasio-Cortez,"I wasn’t born rich and became the youngest woman in American history to be elected to Congress.

Then I investigated Cohen, authored the largest FEMA funeral assistance program in history and led creation of a US Climate Corps to create tens of thousands of new jobs.

Stay mad 💁🏽‍♀️",2023-09-27 13:47:14+00:00
416,Elon Musk,@stclairashley She’s just not that smart,2023-09-27 04:04:14+00:00
417,Alexandria Ocasio-Cortez,RT @abughazalehkat: Fox News tried to do a bunch of scary man-on-the-street interviews about crime. It didn't go well. https://t.co/49PVjwgFBB,2023-09-27 02:59:24+00:00
418,Kat Abu,Fox News tried to do a bunch of scary man-on-the-street interviews about crime. It didn't go well. https://t.co/49PVjwgFBB,2023-09-26 21:09:00+00:00
419,Alexandria Ocasio-Cortez,"Presenting: Team AOC's 2022 Unwrapped! 🎁

Ever wonder what your Representative has been up to? We're proud to share our annual report to constituents and supporters across the country!

Here's our 22 Wins for 2022🏆
Want to help for 2023? Share + sign up: https://t.co/0o7guZ7Hbm https://t.co/ucb6Hcd6Ai",2022-12-21 18:18:34+00:00
420,Alexandria Ocasio-Cortez,"Happy to hear! We’ve been helping lead a bipartisan push alongside @RepDaveJoyce to help expunge state and local-level cannabis offenses.

The momentum growing on this is genuinely encouraging. We’re going to keep pushing until we get it done 💪🏽",2023-09-27 02:51:28+00:00
421,Natalie Fertig,"NEW: Sen Kevin Cramer just told me he loves the HOPE Act, a criminal justice-focused bill which could be added to the cannabis banking bill on the Senate floor should it proceed from the committee markup tomorrow. https://t.co/xgvAddJVp8",2023-09-26 20:18:27+00:00
422,Alexandria Ocasio-Cortez,"RT @RepRashida: Welcome to Michigan, @POTUS! #StandUpUAW https://t.co/tEGCKekoDr",2023-09-27 02:41:24+00:00
423,Congresswoman Rashida Tlaib,"Welcome to Michigan, @POTUS! #StandUpUAW https://t.co/tEGCKekoDr",2023-09-26 17:23:07+00:00
424,Christmasy,"🧓✏️ GRANDPARENT ALERT ✔️ Reusable Design ✔️ Easy Way to Learn Math, Calligraphy, Motor Skills And More! Get Yours Today ➡️ 
https://t.co/5WjvSgHYGy",2023-12-01 02:30:16+00:00
425,Alexandria Ocasio-Cortez,Boy math is needing 15 attempts to count the votes correctly to become Speaker and then shutting down the government 9 months later,2023-09-27 02:08:00+00:00
426,Alexandria Ocasio-Cortez,"McCarthy already got his meeting w/ Biden and they struck a deal to keep gov open months ago. GOP held the entire US gov hostage in exchange for cuts &amp; forced restart of student loan payments.

Deal is done. Biden held his end. Nothing to relitigate. McCarthy can go pound sand",2023-09-27 01:53:15+00:00
427,Sahil Kapur,"Four days to go till a shutdown.

Things are getting weirder.

McCarthy—who reneged on a 2-year budget deal he struck with Biden under pressure from his hardliners, and has struggled to pass a funding bill through the House—now wants a meeting with Biden.

https://t.co/0bkYjXPkyG",2023-09-26 17:31:23+00:00
428,Alexandria Ocasio-Cortez,"First President in modern American history to join a union picket line. 

That’s in no small part thanks to a modern surge in worker organizing and record public support of unions. 

Keep going ✊🏽",2023-09-26 19:19:26+00:00
429,Acyn,"Biden: You guys saved auto industry… made a lot of sacrifices. Gave up a lot. And the companies were in trouble. Now, they're doing incredibly And guess what. You should be doing incredibly well, too. https://t.co/VOcTbnuzGg",2023-09-26 17:08:56+00:00
430,Alexandria Ocasio-Cortez,"RT @metzgov: In newsletter to constituents, @AOC lists services likely to be impacted by the all-but-certain government shutdown.

https://t.co/Yh8SsWQN8o https://t.co/wPJskaVXk6",2023-09-26 18:52:24+00:00
431,bryan metzger,"In newsletter to constituents, @AOC lists services likely to be impacted by the all-but-certain government shutdown.

https://t.co/Yh8SsWQN8o https://t.co/wPJskaVXk6",2023-09-26 17:45:48+00:00
432,Alexandria Ocasio-Cortez,"Had a great time yesterday rallying with @UAW and @CoriBush in Wentzville, MO 😎✊🏽 #StandUpUAW https://t.co/VZOBZKZB71",2023-09-26 02:53:08+00:00
433,Alexandria Ocasio-Cortez,"RT @StephKukuljan: .@AOC joined @CoriBush in providing solidarity with striking @UAW workers at the Wentzville plant
@stltoday https://t.co/yuiVUtlDIk",2023-09-24 23:35:10+00:00
434,steph kukuljan,".@AOC joined @CoriBush in providing solidarity with striking @UAW workers at the Wentzville plant
@stltoday https://t.co/yuiVUtlDIk",2023-09-24 21:04:53+00:00
435,Alexandria Ocasio-Cortez,RT @TVietor08: Very glad @AOC is talking about the need to rethink US sanctions on Venezuela. Broad-based sanctions are not changing Maduro’s policies but are harming people and leading them to migrate to the US border.,2023-09-24 23:14:25+00:00
436,Tommy Vietor,Very glad @AOC is talking about the need to rethink US sanctions on Venezuela. Broad-based sanctions are not changing Maduro’s policies but are harming people and leading them to migrate to the US border.,2023-09-24 18:20:49+00:00
437,Acyn,"AOC: In this specific instance, sanctions that were originally authored by Marco Rubio took a large part in the driving of populations to our southern border, shortly after those sanctions were enacted, we started seeing dramatic increases https://t.co/MVvX3MT8J0",2023-09-24 14:54:54+00:00
438,Alexandria Ocasio-Cortez,"To actually address the asylum crisis, we must start with the US foreign policy and global dynamics creating it.

The broad Trump/Rubio sanctions have played a major role in driving millions of people out of Venezuela. Serious discussions about asylum seekers should address that.",2023-09-24 16:06:56+00:00
439,Alexandria Ocasio-Cortez,"RT @TweetBenMax: once it becomes sentient, however, the robot will make at least $40K in overtime",2023-09-22 22:19:49+00:00
440,Ben Max,"once it becomes sentient, however, the robot will make at least $40K in overtime",2023-09-22 21:27:16+00:00
441,Gothamist,"Mayor Adams proudly compared the costs of the robo-cop to that of a human transit cop: The city is leasing the robot for $9-an-hour.

“This is a good investment of taxpayer dollars. This is below minimum wage, no bathroom breaks, no meal breaks.”
https://t.co/vBRDMBr6tL",2023-09-22 19:02:02+00:00
442,Alexandria Ocasio-Cortez,"RT @tedlieu: Clarence Thomas secretly accepted millions in lavish gifts from billionaires.

He secretly shows up at a fundraiser for billionaires to help raise money for a super PAC.

And he votes on cases to help billionaires.

This isn’t the appearance of corruption, this is corruption.",2023-09-22 21:43:17+00:00
443,Ted Lieu,"Clarence Thomas secretly accepted millions in lavish gifts from billionaires.

He secretly shows up at a fundraiser for billionaires to help raise money for a super PAC.

And he votes on cases to help billionaires.

This isn’t the appearance of corruption, this is corruption.",2023-09-22 19:56:25+00:00
444,Richard W. Painter,"Justice Thomas violated: 1) financial disclosure laws, 2) laws prohibiting judges from participating in partisan fundraising (the Kochs have a Super PAC) and 3) recusal laws for judges. 28 U.S.C. 455.  He simply does not understand or care about the law.
https://t.co/s1Nnk1KcRb",2023-09-22 13:40:45+00:00
445,Alexandria Ocasio-Cortez,NYC schools got defunded to pay for these privacy disasters on wheels,2023-09-22 21:39:40+00:00
446,katie honan,".@NYCMayor with the robocop, which cannot make the heart with the mayor because it has no arms https://t.co/vuvkmslYwz",2023-09-22 13:11:44+00:00
447,Alexandria Ocasio-Cortez,"RT @Acyn: Neguse: The question that I am trying to reconcile is why the Republican majority decided to spend the summer on bills on gas stoves and the prairie chicken and then send everyone home for a 47-day recess, only to come back seven days before the government is slated to shut down https://t.co/LaoqDzr2sa",2023-09-22 18:38:00+00:00
448,Acyn,"Neguse: The question that I am trying to reconcile is why the Republican majority decided to spend the summer on bills on gas stoves and the prairie chicken and then send everyone home for a 47-day recess, only to come back seven days before the government is slated to shut down https://t.co/LaoqDzr2sa",2023-09-22 18:22:26+00:00
449,Alexandria Ocasio-Cortez,"I’ve been getting a LOT of questions about the student loan payment pause lifting on Oct 1st, how to navigate, and the future of cancellation.

So we’ve put together a 6-part student loan guide to help folks out.

Check it out on IG, YouTube, and TikTok: https://t.co/yzmgnDT0zF https://t.co/ARcAqQBWIZ",2023-09-22 18:29:05+00:00
450,Alexandria Ocasio-Cortez,Here’s the full series on YouTube: https://t.co/sxBkDrT0pG,2023-09-22 18:29:36+00:00
451,Alexandria Ocasio-Cortez,"We have already been getting great feedback this week, including from folks who had no idea their loans were eligible for cancellation *now* or who lowered their payments to $0/month under SAVE.

Great options in short term as we fight for broader cancellation 💪🏽",2023-09-22 18:33:04+00:00
452,Alexandria Ocasio-Cortez,"RT @ZohranKMamdani: 5 bus lines serving 43,900+ New Yorkers will be free starting this Sunday, September 24. #FixTheMTA

Here's why that matters: https://t.co/Rh3Zgnzuvg",2023-09-22 15:41:00+00:00
453,Zohran Kwame Mamdani,"5 bus lines serving 43,900+ New Yorkers will be free starting this Sunday, September 24. #FixTheMTA

Here's why that matters: https://t.co/Rh3Zgnzuvg",2023-09-22 13:43:07+00:00
454,Alexandria Ocasio-Cortez,RT @propublica: NEW: A ProPublica investigation has found that Supreme Court Justice Clarence Thomas secretly participated in Koch network donor events –  a breach of judicial norms that one federal judge said “takes my breath away.” 🧵👇,2023-09-22 12:54:04+00:00
455,ProPublica,NEW: A ProPublica investigation has found that Supreme Court Justice Clarence Thomas secretly participated in Koch network donor events –  a breach of judicial norms that one federal judge said “takes my breath away.” 🧵👇,2023-09-22 09:34:22+00:00
456,Alexandria Ocasio-Cortez,"RT @akela_lacy: AIPAC’s only incumbent targets so far for 2024 are progressive members of the Congressional Black Caucus. I asked CBC to respond to AIPAC’s efforts to recruit primary challengers to Reps. Ilhan Omar, Jamaal Bowman &amp; Summer Lee. CBC did not comment https://t.co/wUYwwsxaRl",2023-09-21 21:44:32+00:00
457,Akela Lacy,"AIPAC’s only incumbent targets so far for 2024 are progressive members of the Congressional Black Caucus. I asked CBC to respond to AIPAC’s efforts to recruit primary challengers to Reps. Ilhan Omar, Jamaal Bowman &amp; Summer Lee. CBC did not comment https://t.co/wUYwwsxaRl",2023-09-21 12:08:10+00:00
458,Alexandria Ocasio-Cortez,"Presenting: Team AOC's 2022 Unwrapped! 🎁

Ever wonder what your Representative has been up to? We're proud to share our annual report to constituents and supporters across the country!

Here's our 22 Wins for 2022🏆
Want to help for 2023? Share + sign up: https://t.co/0o7guZ7Hbm https://t.co/ucb6Hcd6Ai",2022-12-21 18:18:34+00:00
459,Alexandria Ocasio-Cortez,"Auto workers on strike are asking everyday people to stand with them by joining their rallies and picket lines.

Join us THIS SUNDAY in St. Louis to support @UAW’s Stand Up strike.

Let’s show the Big 3 what solidarity really looks like 💪🏽Wear red &amp; see you Sunday! #StandUpUAW",2023-09-21 21:16:02+00:00
460,UAW,"SUNDAY at 3 pm: Solidarity Rally with Congresswoman Alexandria Ocasio-Cortez, Missouri Congresswoman Cori Bush, #UAW Region 4 Director Brandon Campbell, &amp; Local 2250 President Katie Deatherage. All welcome. Wear red for solidarity!
#StandUpUAW #SolidaritySeason
@RepCori @RepAOC https://t.co/7qXXRG8UWZ",2023-09-21 20:12:21+00:00
461,Alexandria Ocasio-Cortez,Wonder how McCarthy’s feeling about eliminating proxy voting and COVID precautions now 🆘 🛟,2023-09-21 19:34:13+00:00
462,Jake Sherman,"“Fucking chaos” … “a total shit show”

Two texts I’ve gotten from inside the House Republican leadership in the last few minutes.",2023-09-21 16:47:02+00:00
463,Alexandria Ocasio-Cortez,"RT @sunrisemvmt: Our movement just won the American Climate Corps. 

Thank you to every young person who fought for and believed in a vision of government that could work for our generation and the planet. This is just the beginning. https://t.co/z1NzxedV8B",2023-09-21 00:17:43+00:00
464,Sunrise Movement 🌅,"Our movement just won the American Climate Corps. 

Thank you to every young person who fought for and believed in a vision of government that could work for our generation and the planet. This is just the beginning. https://t.co/z1NzxedV8B",2023-09-20 13:17:19+00:00
465,Alexandria Ocasio-Cortez,"MAJOR victory today 🎉

In 2021, we proposed the Climate Corps and launched a massive inside-outside organizing effort to win it.

Today, the American Climate Corps has finally come true.

Thank you to @POTUS and the countless communities and organizers who made this a reality💪🏽",2023-09-21 00:10:47+00:00
466,President Biden,"Today, I'm taking executive action to launch the American Climate Corps – a workforce initiative that will train over 20,000 young people for good-paying jobs in the clean energy and climate resilience economy.

https://t.co/PPJg1aoo2y",2023-09-20 14:05:00+00:00
467,Alexandria Ocasio-Cortez,"RT @UAW: “I see power.”
STAND UP.
#StandUpUAW https://t.co/VwVTZ2ZJHP",2023-09-20 23:56:20+00:00
468,UAW,"“I see power.”
STAND UP.
#StandUpUAW https://t.co/VwVTZ2ZJHP",2023-09-20 18:54:16+00:00
469,Alexandria Ocasio-Cortez,RT @WhiteHouse: https://t.co/Z48ppBkBZQ,2023-09-20 23:49:14+00:00
