,Name,Text,Time
0,Alexandria Ocasio-Cortez,"Presenting: Team AOC's 2022 Unwrapped! 🎁

Ever wonder what your Representative has been up to? We're proud to share our annual report to constituents and supporters across the country!

Here's our 22 Wins for 2022🏆
Want to help for 2023? Share + sign up: https://t.co/0o7guZ7Hbm https://t.co/ucb6Hcd6Ai",2022-12-21 18:18:34+00:00
1,Alexandria Ocasio-Cortez,"RT @RepAOC: Republicans constantly justify drilling by promising big economic payouts. But drilling in the Arctic Refuge — a historically protected area — was supposed to generate billions in revenue to pay for Trump’s 2017 Tax Cuts and Jobs Act. In the end, it only generated $6 million. https://t.co/b4HHp9Bkqr",2023-11-29 23:19:53+00:00
2,Rep. Alexandria Ocasio-Cortez,"Republicans constantly justify drilling by promising big economic payouts. But drilling in the Arctic Refuge — a historically protected area — was supposed to generate billions in revenue to pay for Trump’s 2017 Tax Cuts and Jobs Act. In the end, it only generated $6 million. https://t.co/b4HHp9Bkqr",2023-11-29 19:53:45+00:00
3,Alexandria Ocasio-Cortez,"The reason GOP don’t want a public hearing on Hunter Biden is because @OversightDems have hoisted them by their own petards in every public hearing this year.

They’re scared of getting humiliated for not having an actual case (again), so they need to hide.

There’s your answer🕵🏽‍♀️",2023-11-28 18:08:01+00:00
4,Acyn,Fox News hosts trying to convince their viewers that a closed door deposition of Hunter Biden is better than a public hearing https://t.co/KPxznk5NUK,2023-11-28 17:25:29+00:00
5,Alexandria Ocasio-Cortez,🌭: “we’re all trying to find the guy who did this”,2023-11-23 01:48:15+00:00
6,AIPAC | Text ISRAEL to 24722 | #StandWithIsrael,"AIPAC was absolutely not involved in any way in this matter. 

Also, our records indicate that this individual has not contributed to AIPAC in over a decade.",2023-11-22 20:06:03+00:00
7,Alexandria Ocasio-Cortez,"The fact that in the US just *1* wealthy person can make a call and offer millions to unseat an official they dislike tells you everything about the corruption of our politics.

It also tells you why the tiny # of members who have managed to beat them are seen as such a threat.",2023-11-22 22:52:44+00:00
8,Nicholas Wu,"NEWS - A Michigan businessman called Dem Senate candidate Hill Harper to offer $20M in campaign contributions if he agreed to drop out and instead mount a primary challenge to Rep. Rashida Tlaib, per source w/ direct knowledge of call 
w/ @UrsulaPerano 
https://t.co/zoYPDgv5ng",2023-11-22 17:41:06+00:00
9,Alexandria Ocasio-Cortez,"Remember all the TV pundits and Wall Street insiders who said these UAW raises were functionally impossible, unrealistic demands?

Now it’s a done deal.

Amazing what courage, solidarity, and ingenuity can do. 

Congratulations, @UAW 🎊",2023-11-21 16:14:48+00:00
10,More Perfect Union,"BREAKING: The @UAW announces that its members at all Big Three automakers have ratified new contracts — with pay increases of 33% between raises and COLA.

Overall, 64% of the workers voted yes. This historic contract marks a huge step forward for renewed labor power.",2023-11-20 15:43:53+00:00
11,Alexandria Ocasio-Cortez,"RT @SenSanders: The Netanyahu government, or hopefully a new Israeli government, must understand that not one penny will be coming to Israel from the U.S. unless there is a fundamental change in their military and political positions. Read my statement: https://t.co/x3LlSRhuYO",2023-11-18 23:44:31+00:00
12,Bernie Sanders,"The Netanyahu government, or hopefully a new Israeli government, must understand that not one penny will be coming to Israel from the U.S. unless there is a fundamental change in their military and political positions. Read my statement: https://t.co/x3LlSRhuYO",2023-11-18 23:07:06+00:00
13,Alexandria Ocasio-Cortez,"RT @prem_thakker: NEW—With Rep. Jamie Raskin, 37 members of Congress are now calling for a ceasefire.

That’s a +13 increase since the Reuters poll was released three days ago, showing 68% of Americans supporting a ceasefire, including about 75% of Democrats and 50% of Republicans. https://t.co/4oXFhYRZHf",2023-11-18 23:07:04+00:00
14,Prem Thakker,"NEW—With Rep. Jamie Raskin, 37 members of Congress are now calling for a ceasefire.

That’s a +13 increase since the Reuters poll was released three days ago, showing 68% of Americans supporting a ceasefire, including about 75% of Democrats and 50% of Republicans. https://t.co/4oXFhYRZHf",2023-11-18 18:30:42+00:00
15,Alexandria Ocasio-Cortez,"Conditioning aid to Israel, as we do with virtually all other US allies, is a responsible course of action.

The United States has a legal and moral responsibility to ensure that public resources do not facilitate gross violations of human rights and international law.",2023-11-18 23:00:22+00:00
16,POLITICO,"Democrats in Senate, House discuss conditioning military aid to Israel https://t.co/XnyLXFkqKk",2023-11-18 17:46:43+00:00
17,Alexandria Ocasio-Cortez,RT @RepGaramendi: My statement on the need for a negotiated ceasefire between Israel and Hamas. https://t.co/FOiHVFdDbh,2023-11-17 22:13:17+00:00
18,John Garamendi,My statement on the need for a negotiated ceasefire between Israel and Hamas. https://t.co/FOiHVFdDbh,2023-11-17 21:10:47+00:00
19,Alexandria Ocasio-Cortez,RT @RepGabeVasquez: My statement on the safe return of hostages and support towards a ceasefire agreement: https://t.co/tQJtaEoNBz,2023-11-17 02:11:43+00:00
20,Rep. Gabe Vasquez,My statement on the safe return of hostages and support towards a ceasefire agreement: https://t.co/tQJtaEoNBz,2023-11-17 00:31:25+00:00
21,Alexandria Ocasio-Cortez,"American Airlines flight attendants are on the picket line at LGA and across the country demanding a fair contract.

It is unacceptable that some of the same attendants who care for us the skies must resort to sleeping in cars because their pay is so low.

Stand with @APFAunity💪🏽",2023-11-17 00:03:58+00:00
22,Dripped Out Trade Unionists,Rep. Alexandria Ocasio-Cortez on the picket line with American Airlines flight attendants at LaGuardia ✊🏻✈️ https://t.co/gTdWm5tBUg,2023-11-16 23:17:52+00:00
23,Alexandria Ocasio-Cortez,"Rep. Becca Balint is now the first Jewish member of Congress to come out in favor of a ceasefire in Gaza.

She is incredibly brave, taking a stance rooted in her commitment to human rights and protection of the innocent.

Read her words. Support her.
Proud to call her a friend.",2023-11-16 20:58:18+00:00
24,Rep. Becca Balint,"The Israeli siege on Gaza has killed thousands of civilians, thousands of children. Millions are without food, water, fuel and medicine. This is dire.

What is needed right now is an immediate break in violence to allow for a true negotiated ceasefire.
https://t.co/6IblwV2XGa",2023-11-16 18:24:42+00:00
25,Alexandria Ocasio-Cortez,"Criticism of the Israeli gov is virtually nonexistent in US politics, but apparently that’s not enough.

Gotta spend *$100 million* to unseat the few who believe in Palestinian human rights &amp; a ceasefire that most Americans already support.

The acceptable level of dissent is 0.",2023-11-15 22:25:18+00:00
26,Alex Sammon,"NEW: Sources say AIPAC is gearing up to spend over *$100 MILLION* as part of a campaign to knock the Squad out of congress in 2024. Cori Bush, Ilhan Omar, Jamaal Bowman, Summer Lee, and Rashida Tlaib are all marked for high dollar challenges. https://t.co/6wXDMEBfNE",2023-11-15 19:36:52+00:00
27,Alexandria Ocasio-Cortez,"RT @RepAOC: Today we are announcing an expanded coalition of 24 members of Congress pressing the Biden administration for a bilateral ceasefire in Gaza on the basis of grave violations of children’s rights.

Proud to co-lead with partners @BettyMcCollum04 and @RepMarkPocan. https://t.co/dykqZuaNrW",2023-11-15 21:46:02+00:00
28,Rep. Alexandria Ocasio-Cortez,"Today we are announcing an expanded coalition of 24 members of Congress pressing the Biden administration for a bilateral ceasefire in Gaza on the basis of grave violations of children’s rights.

Proud to co-lead with partners @BettyMcCollum04 and @RepMarkPocan. https://t.co/dykqZuaNrW",2023-11-15 20:07:24+00:00
29,Alexandria Ocasio-Cortez,"RT @zhang_sharon: New: 24 House members, led by @AOC, have sent a letter to Biden and Blinken calling for a ""bilateral ceasefire."" 

""We are profoundly shocked by the grave violations of children’s rights in the context of armed conflict in Israel and the Occupied Palestinian Territory.""",2023-11-15 17:55:34+00:00
30,sharon zhang,"New: 24 House members, led by @AOC, have sent a letter to Biden and Blinken calling for a ""bilateral ceasefire."" 

""We are profoundly shocked by the grave violations of children’s rights in the context of armed conflict in Israel and the Occupied Palestinian Territory.""",2023-11-15 17:16:35+00:00
31,Alexandria Ocasio-Cortez,"RT @RepAOC: Grateful to have joined Rabbis for Ceasefire tonight.

Ceasefire means release the hostages.
Ceasefire means stop the bombardment.
Ceasefire means defend the innocent.
Ceasefire means transcend cycles of violence.
Ceasefire is not just an option. It is our only way out of this. https://t.co/8onOHvSUij",2023-11-14 02:53:05+00:00
32,Rep. Alexandria Ocasio-Cortez,"Grateful to have joined Rabbis for Ceasefire tonight.

Ceasefire means release the hostages.
Ceasefire means stop the bombardment.
Ceasefire means defend the innocent.
Ceasefire means transcend cycles of violence.
Ceasefire is not just an option. It is our only way out of this. https://t.co/8onOHvSUij",2023-11-14 02:09:03+00:00
33,Alexandria Ocasio-Cortez,"RT @SenWhitehouse: The question is enforcement: where do you file a complaint; who reviews it; how does fact finding occur; who compares what happened to what’s allowed? 

That’s where the rubber hits the road. 🧵 https://t.co/5eri7FAyQv",2023-11-14 02:12:00+00:00
34,Sheldon Whitehouse,"The question is enforcement: where do you file a complaint; who reviews it; how does fact finding occur; who compares what happened to what’s allowed? 

That’s where the rubber hits the road. 🧵 https://t.co/5eri7FAyQv",2023-11-13 20:08:20+00:00
35,Alexandria Ocasio-Cortez,There is power in a union. Congratulations @sagaftra!,2023-11-09 17:34:38+00:00
36,SAG-AFTRA,"THE #SagAftraStrike IS OVER.

🧵 Thread below. https://t.co/KDTl9uKBRt",2023-11-09 02:28:42+00:00
37,Alexandria Ocasio-Cortez,"RT @RepRashida: I am the only Palestinian American serving in Congress, and my perspective is needed here now more than ever. I will not be silenced and I will not let anyone distort my words.

I’m from Detroit, where I learned to speak truth to power, even if my voice shakes. https://t.co/bXhGPCcKat",2023-11-08 15:08:22+00:00
38,Congresswoman Rashida Tlaib,"I am the only Palestinian American serving in Congress, and my perspective is needed here now more than ever. I will not be silenced and I will not let anyone distort my words.

I’m from Detroit, where I learned to speak truth to power, even if my voice shakes. https://t.co/bXhGPCcKat",2023-11-07 21:10:01+00:00
39,Alexandria Ocasio-Cortez,"It is not lost on anyone how many offensive, violent, and racist things people regularly hear members of Congress say, yet virtually the only one that gets censured for her political speech also happens to be the only Palestinian American.

It does not reflect well. At all.",2023-11-08 14:01:52+00:00
40,The Recount,"“This resolution is about one thing and one thing only: the punishment of speech.”

– Rep. Jamie Raskin (D-MD) speaks in opposition to a resolution to censure Rep. Rashida Tlaib (D-MI) https://t.co/XSU6kMUaeH",2023-11-07 20:20:02+00:00
41,Alexandria Ocasio-Cortez,"Presenting: Team AOC's 2022 Unwrapped! 🎁

Ever wonder what your Representative has been up to? We're proud to share our annual report to constituents and supporters across the country!

Here's our 22 Wins for 2022🏆
Want to help for 2023? Share + sign up: https://t.co/0o7guZ7Hbm https://t.co/ucb6Hcd6Ai",2022-12-21 18:18:34+00:00
42,Alexandria Ocasio-Cortez,"RT @mehdirhasan: 10,000-plus Palestinians killed, including 4,000-plus kids, and the U.S. House of Representatives is busy censuring… the only Palestinian-American member. Can’t make this stuff up.",2023-11-08 05:23:09+00:00
43,Mehdi Hasan,"10,000-plus Palestinians killed, including 4,000-plus kids, and the U.S. House of Representatives is busy censuring… the only Palestinian-American member. Can’t make this stuff up.",2023-11-08 03:36:29+00:00
44,Arthur Delaney 🇺🇸,Rashida Tlaib CENSURED w/ 22 Dems joining Republicans https://t.co/I5quw6BjuP,2023-11-08 03:28:35+00:00
45,Alexandria Ocasio-Cortez,"RT @Redistrict: I've seen enough: in a victory for the pro-choice side, Ohio Issue 1, a measure to establish a right to an abortion in the state constitution, passes.",2023-11-08 03:54:02+00:00
46,Dave Wasserman,"I've seen enough: in a victory for the pro-choice side, Ohio Issue 1, a measure to establish a right to an abortion in the state constitution, passes.",2023-11-08 01:26:12+00:00
47,Alexandria Ocasio-Cortez,RT @rafaelshimunov: Jewish activists with @jvplive have taken the Statue of Liberty for #CeasefireForNOW in Gaza https://t.co/InqkVEmLQP,2023-11-06 18:17:52+00:00
48,Rafael Shimunov,Jewish activists with @jvplive have taken the Statue of Liberty for #CeasefireForNOW in Gaza https://t.co/InqkVEmLQP,2023-11-06 17:59:18+00:00
49,Alexandria Ocasio-Cortez,RT @patrickgaspard: I’m struck by the absolute certitude and hearing yet again there’s an expertise that some have about making war and that those protesting lack. I remember protesting my Govt voting to give war authorization in Iraq. We were told that we just didn’t understand. With this certitude,2023-11-05 22:46:13+00:00
50,Patrick Gaspard,I’m struck by the absolute certitude and hearing yet again there’s an expertise that some have about making war and that those protesting lack. I remember protesting my Govt voting to give war authorization in Iraq. We were told that we just didn’t understand. With this certitude,2023-11-05 13:38:49+00:00
51,Yashar Ali 🐘,"In a conversation with @NorahODonnell, Secretary Hillary Clinton on those calling for a ceasefire: 

“People who are calling for a ceasefire now do not understand Hamas, that is not possible. It would be such a gift to Hamas because they would spend whatever time there was a ceasefire in effect rebuilding their armaments, creating stronger positions to be able to fend off an eventual assault by the Israelis.” 

She also added that the Israeli government had a responsibility to limit civilian casualties.",2023-10-30 03:46:13+00:00
52,Alexandria Ocasio-Cortez,"RT @MoveOn: As @AIPAC continues to attack progressives, it's critical to remember that AIPAC fights diplomacy, has routinely engaged in Islamophobic smears, and, through its support of over 100 insurrectionist Republicans, remains an opponent of democracy.",2023-11-04 17:01:43+00:00
53,MoveOn,"As @AIPAC continues to attack progressives, it's critical to remember that AIPAC fights diplomacy, has routinely engaged in Islamophobic smears, and, through its support of over 100 insurrectionist Republicans, remains an opponent of democracy.",2023-11-03 19:03:33+00:00
54,Alexandria Ocasio-Cortez,"AIPAC endorsed scores of Jan 6th insurrectionists. They are no friend to American democracy.

They are one of the more racist and bigoted PACs in Congress as well, who disproportionately target members of color.

They are an extremist organization that destabilizes US democracy.",2023-11-01 01:30:28+00:00
55,Alexandria Ocasio-Cortez,"Our country subjects people in need of food assistance to a litany of conditions to qualify, yet refuses to place a *single* condition on billions of public funds to prevent enabling an atrocity.

It is appalling. Thousands of children, dead. This is the result of “no red lines.”",2023-11-04 16:02:13+00:00
56,Alexandria Ocasio-Cortez,"66% of American voters across all political affiliations support a ceasefire, but if you support one in Congress you’re “far left.”

Left of what? 🤔",2023-11-04 13:11:34+00:00
57,Adam Shatz,"Question to the @nytimes: why is the paper referring— in its *reporting*—to Rashida Tlaib and other Democrats calling for a ceasefire as ‘far left’? Tlaib, A0C, Omar et al are Sanders Democrats. The effect (if not the intention) is to make them seem beyond the pale. They are not.",2023-11-04 12:20:17+00:00
58,Alexandria Ocasio-Cortez,"RT @alex_sammon: Biden admin officials admitting that the pressure on them to call for a ceasefire is becoming undeniable. All the calling, emailing, and protesting is working. https://t.co/N0A97TbQRq",2023-11-03 23:52:33+00:00
59,Alex Sammon,"Biden admin officials admitting that the pressure on them to call for a ceasefire is becoming undeniable. All the calling, emailing, and protesting is working. https://t.co/N0A97TbQRq",2023-11-03 14:09:27+00:00
60,Alexandria Ocasio-Cortez,"RT @RepJasonCrow: This should not have happened.

I have fought wars in crowded cities. When civilians were present, it changed our plans.

Terrorists often use humans as shields. But that does not change your obligation to protect civilians. Period.",2023-11-03 03:39:52+00:00
61,Rep. Jason Crow,"This should not have happened.

I have fought wars in crowded cities. When civilians were present, it changed our plans.

Terrorists often use humans as shields. But that does not change your obligation to protect civilians. Period.",2023-11-02 18:21:28+00:00
62,CNN,JUST IN: Israel confirms an IDF attack caused the massive blast at Gaza's largest refugee camp that has reportedly left many people dead and injured https://t.co/BaxwPbrmkX,2023-10-31 18:09:46+00:00
63,Alexandria Ocasio-Cortez,"RT @IfNotNowOrg: This ad campaign targeting Rashida Tlaib is dangerous. It should be condemned by Democrats and taken down now.

@DemMaj4Israel &amp; @AIPAC use Republican donor money to pit Jewish Democrats against Muslim Democrats.

We won’t let them tear our communities apart with fear-mongering.",2023-11-02 19:40:40+00:00
64,IfNotNow🔥,"This ad campaign targeting Rashida Tlaib is dangerous. It should be condemned by Democrats and taken down now.

@DemMaj4Israel &amp; @AIPAC use Republican donor money to pit Jewish Democrats against Muslim Democrats.

We won’t let them tear our communities apart with fear-mongering.",2023-11-02 17:45:52+00:00
65,Josh Kraushaar,"BREAKING: Democratic Majority For Israel goes up with 6-figure ad buy in Detroit against Rep. Rashida Tlaib (D-MI) over her hostility against Israel.

Ad is titled: “History and Humanity” https://t.co/vwHlT0D7JO",2023-11-02 10:54:26+00:00
66,Alexandria Ocasio-Cortez,"RT @WorkingFamilies: .@AOC is spot on. 

In Democratic primaries, @AIPAC uses Republican dollars to attack candidates who believe in Medicare for All, universal childcare, tuition-free college, and so much more. 

In general elections, it backs extremist insurrectionists who undermine our democracy.",2023-11-02 18:59:55+00:00
67,Working Families Party 🐺,".@AOC is spot on. 

In Democratic primaries, @AIPAC uses Republican dollars to attack candidates who believe in Medicare for All, universal childcare, tuition-free college, and so much more. 

In general elections, it backs extremist insurrectionists who undermine our democracy.",2023-11-02 16:29:24+00:00
68,Alexandria Ocasio-Cortez,"RT @UNHumanRights: #Gaza – Given the high number of civilian casualties &amp; the scale of destruction following Israeli airstrikes on Jabalia refugee camp, we have serious concerns that these are disproportionate attacks that could amount to war crimes. https://t.co/ky2jYVrhJq",2023-11-02 04:27:32+00:00
69,UN Human Rights,"#Gaza – Given the high number of civilian casualties &amp; the scale of destruction following Israeli airstrikes on Jabalia refugee camp, we have serious concerns that these are disproportionate attacks that could amount to war crimes. https://t.co/ky2jYVrhJq",2023-11-01 18:30:05+00:00
70,Alexandria Ocasio-Cortez,"Think about how frequently Congress raises the prospect of publicly disciplining the only two Muslim women here (today considered censure), and compare that to the ease in which this Rep unfurls bigotry on the House floor.

We can stop pretending people are treated equally here.",2023-11-02 03:33:59+00:00
71,Acyn,"Mast: I think when we look at this, as a whole, I would encourage the other side to not so lightly throw around the idea of innocent Palestinian civilians. I don't think we would so lightly throw around the term innocent Nazi civilians https://t.co/OqDpJHZiHV",2023-11-01 18:49:24+00:00
72,Alexandria Ocasio-Cortez,"Ady gave everything he had fighting for others and Medicare for All.

He was a gift to this country and to all who knew him. This is a heartbreaking loss.

Sending love and strength to Ady’s family, his wife Rachael, and his children. We won’t stop until Ady’s vision is realized.",2023-11-02 02:31:11+00:00
73,Ady Barkan,"Hi all, this is Ady’s wife, Rachael. I’m devastated to share the news that Ady has died from complications of ALS. You probably knew Ady as a healthcare activist. But more importantly he was a wonderful dad and my life partner for 18 years. [1/4] https://t.co/KZ8k73Gujp",2023-11-02 01:52:00+00:00
74,Alexandria Ocasio-Cortez,"RT @IlhanMN: AIPAC literally ran ads with my face next to Hamas rockets, resulting in a string of threats against my life. 

When Democratic Leadership called them out, they refused to apologize and kept the ads up. 

What they are doing is insulting and Islamophobic.

You cannot claim to be progressive while launching a Super PAC that exclusively targets progressives and supports Republicans in the general.",2023-11-01 22:03:59+00:00
75,Ilhan Omar,"AIPAC literally ran ads with my face next to Hamas rockets, resulting in a string of threats against my life. 

When Democratic Leadership called them out, they refused to apologize and kept the ads up. 

What they are doing is insulting and Islamophobic.

You cannot claim to be progressive while launching a Super PAC that exclusively targets progressives and supports Republicans in the general.",2023-11-01 20:43:50+00:00
76,Mark Pocan,"What @AIPAC doesn’t tell you is they raise money from big Republican donors &amp; spend it in Democratic primaries against Democrats. It’s a cynical, undemocratic strategy. And since they clearly don’t care about dead, kids, it’s all about backing a conservative Netanyahu position.",2023-11-01 13:52:50+00:00
77,Alexandria Ocasio-Cortez,"RT @jdakwar: ACLU to 650 college and university leaders: Reject calls to investigate, disband, or penalize pro-Palestinian student groups for exercising their free speech rights. https://t.co/bow8O5lmlY https://t.co/6ld8qEJRAc",2023-11-01 21:16:24+00:00
78,Jamil Dakwar,"ACLU to 650 college and university leaders: Reject calls to investigate, disband, or penalize pro-Palestinian student groups for exercising their free speech rights. https://t.co/bow8O5lmlY https://t.co/6ld8qEJRAc",2023-11-01 20:34:17+00:00
79,Alexandria Ocasio-Cortez,"Honored to work with you on this, @tedlieu!",2023-11-01 18:36:45+00:00
80,Ted Lieu,"Honored to introduce legislation with @AOC to reduce sexual harassment in the workplace. The bill requires publicly traded companies to disclose the existence/status of sexual harassment and discrimination claims, and any settlements paid out to victims.

https://t.co/jRiYXvsYl0",2023-11-01 14:58:20+00:00
81,Alexandria Ocasio-Cortez,"RT @tedlieu: Honored to introduce legislation with @AOC to reduce sexual harassment in the workplace. The bill requires publicly traded companies to disclose the existence/status of sexual harassment and discrimination claims, and any settlements paid out to victims.

https://t.co/jRiYXvsYl0",2023-11-01 18:31:30+00:00
82,Alexandria Ocasio-Cortez,"Rep @MarkPocan is right. 

It is past time for us to recognize how toxic of a presence AIPAC has been in our political system.

They actively boost candidates who tried to overthrow the US election &amp; run smear campaigns on members of Congress who stand up for human rights. Enough",2023-11-01 14:49:13+00:00
83,Alexandria Ocasio-Cortez,"RT @MarkPocan: Got to admit, this sums up how many feel about what @AIPAC really is about. Insurrectionists, WTF. No friend of democracy.",2023-11-01 04:41:10+00:00
84,Mark Pocan,"Got to admit, this sums up how many feel about what @AIPAC really is about. Insurrectionists, WTF. No friend of democracy.",2023-11-01 04:15:07+00:00
85,Alexandria Ocasio-Cortez,"Presenting: Team AOC's 2022 Unwrapped! 🎁

Ever wonder what your Representative has been up to? We're proud to share our annual report to constituents and supporters across the country!

Here's our 22 Wins for 2022🏆
Want to help for 2023? Share + sign up: https://t.co/0o7guZ7Hbm https://t.co/ucb6Hcd6Ai",2022-12-21 18:18:34+00:00
86,Alexandria Ocasio-Cortez,"RT @justicedems: In fact, AIPAC endorsed 109 Republican members of Congress that voted to overturn Joe Biden’s election—including the current Speaker Mike Johnson.",2023-11-01 01:54:49+00:00
87,Justice Democrats,"In fact, AIPAC endorsed 109 Republican members of Congress that voted to overturn Joe Biden’s election—including the current Speaker Mike Johnson.",2023-11-01 01:43:28+00:00
88,Alexandria Ocasio-Cortez,"AIPAC endorsed scores of Jan 6th insurrectionists. They are no friend to American democracy.

They are one of the more racist and bigoted PACs in Congress as well, who disproportionately target members of color.

They are an extremist organization that destabilizes US democracy.",2023-11-01 01:30:28+00:00
