,Name,Text,Time
834,Alexandria Ocasio-Cortez,"RT @ryangrim: Looks like Erdogan demanded @elonmusk censor his political opposition a day ahead of the election and he immediately complied. 

Musk is either the world’s most sanctimonious hypocrite, coward and fraud or actually wants to censor the opposition to help Erdogan. Or both.",2023-05-13 16:38:02+00:00
835,Ryan Grim,"Looks like Erdogan demanded @elonmusk censor his political opposition a day ahead of the election and he immediately complied. 

Musk is either the world’s most sanctimonious hypocrite, coward and fraud or actually wants to censor the opposition to help Erdogan. Or both.",2023-05-13 15:01:31+00:00
836,Global Government Affairs,"In response to legal process and to ensure Twitter remains available to the people of Turkey, we have taken action to restrict access to some content in Turkey today.",2023-05-13 03:00:14+00:00
837,Alexandria Ocasio-Cortez,"New Yorkers are ready to employ and asylum seekers are ready to work.

The idea that denying work authorization is an effective deterrent and therefore we shouldn’t let people work is wrong. It keeps people crammed in the system &amp; hurts migrants &amp; citizens alike.

Let them work.",2023-05-13 16:37:09+00:00
838,Alexandria Ocasio-Cortez,"Anti-immigrant policies reap what they sow. DeSantis’ Florida is about to find that out.

The US has such deep needs right now, particularly in labor. Yet policymakers (of ALL stripes) take our immigrant communities for granted.

No más. Time to stop biting the hands that feed.",2023-05-13 16:27:52+00:00
839,Arturo Dominguez 🇨🇺🇺🇲,"Spanish language social media has exploded with Latino truck drivers calling for a boycott and refusing to take shipments into Florida.

Things are about to get interesting.",2023-05-13 05:15:30+00:00
840,Alexandria Ocasio-Cortez,Así es 💪🏽💪🏽 fuerza hermano,2023-05-13 16:20:18+00:00
841,Arturo Dominguez 🇨🇺🇺🇲,Here's one (in Spanish): https://t.co/KJKRolszXQ,2023-05-13 05:20:49+00:00
842,Alexandria Ocasio-Cortez,"New Yorkers &amp; small businesses have made clear that we are ready to employ our migrant neighbors.

And our newly arrived NYers have stated clearly that they want to support themselves safely.

Let’s get it done. We are asking the Federal gov to grant us work authorizations!",2023-05-12 14:31:40+00:00
843,Axios,"A group of Democrats led by Rep. Alexandria Ocasio-Cortez are asking President Biden to find ways to allow asylum seekers to get work permits faster.

https://t.co/XZSvLPe0oe",2023-05-12 10:28:11+00:00
844,Alexandria Ocasio-Cortez,"The coalition united in this push represents a significant breakthrough.

Thank you @SenSchumer, @RepJeffries, @SenGillibrand, @RepJerryNadler, @NydiaVelazquez, @RepEspaillat, @JamaalBowmanNY, @RepRitchie, @RepGregoryMeeks, @Grace4NY, @RepYvetteClarke, @RepDanGoldman",2023-05-12 14:39:20+00:00
845,Alexandria Ocasio-Cortez,"RT @housing4allNY: 🚨🚨 JOIN NYC’S BIGGEST TENANT MOBILIZATION IN YEARS 🚨🚨

Landlords are squeezing us for all we got. The rent. is. too. damn. high.

It's time to fight back. RSVP + more info: https://t.co/xxRTjjXKYJ https://t.co/cG2WfqZmfw",2023-05-12 01:42:16+00:00
846,Housing Justice For All,"🚨🚨 JOIN NYC’S BIGGEST TENANT MOBILIZATION IN YEARS 🚨🚨

Landlords are squeezing us for all we got. The rent. is. too. damn. high.

It's time to fight back. RSVP + more info: https://t.co/xxRTjjXKYJ https://t.co/cG2WfqZmfw",2023-05-11 18:09:44+00:00
847,Alexandria Ocasio-Cortez,"RT @ChrisVanHollen: Today marks 1 yr. since US citizen &amp; journalist, Shireen Abu Akleh, was shot &amp; killed while reporting in the West Bank, wearing her full press regalia. Her family, other journalists &amp; the US haven't seen an independent investigation &amp; accountability. We must not rest until we do. https://t.co/SwzvsTx2co",2023-05-11 23:50:55+00:00
848,Senator Chris Van Hollen,"Today marks 1 yr. since US citizen &amp; journalist, Shireen Abu Akleh, was shot &amp; killed while reporting in the West Bank, wearing her full press regalia. Her family, other journalists &amp; the US haven't seen an independent investigation &amp; accountability. We must not rest until we do. https://t.co/SwzvsTx2co",2023-05-11 13:18:29+00:00
849,Alexandria Ocasio-Cortez,"Welcome to the Capitol, @ZoAndBehold!",2023-05-11 23:50:08+00:00
850,Rep. Zooey Zephyr,"I was honored to meet with several members of congress today to talk about the work ahead.

Our conversations all centered on how to stand up for democracy, and how to work with the communities we represent to ensure that they are empowered to stand up as well. https://t.co/u8NmpBG2qY",2023-05-11 23:03:29+00:00
851,Alexandria Ocasio-Cortez,"Let’s go Philly! 
See you this weekend 🥰",2023-05-11 23:05:06+00:00
852,Helen Gym,"This Sunday, join me, @BernieSanders, @AOC, and local leaders + musical guests to rally for the city we all deserve — one where our young people are educated, our workers are protected, and our communities are safe.

RSVP: https://t.co/YiBdlvCepZ https://t.co/dOYHo4C1Ol",2023-05-11 18:44:25+00:00
853,Alexandria Ocasio-Cortez,RT @Acyn: Wallace: CNN recently very publicly parted ways with Don Lemon. It came in the aftermath of a comment he made that was viewed by his managers as misogynistic. Those very same managers are the people who aired Trump’s misogynistic attacks last night on E. Jean Carroll https://t.co/dXuldP7ym3,2023-05-11 23:02:57+00:00
854,Acyn,Wallace: CNN recently very publicly parted ways with Don Lemon. It came in the aftermath of a comment he made that was viewed by his managers as misogynistic. Those very same managers are the people who aired Trump’s misogynistic attacks last night on E. Jean Carroll https://t.co/dXuldP7ym3,2023-05-11 20:09:20+00:00
855,Alexandria Ocasio-Cortez,"RT @RepAOC: Today during a committee hearing on the Boundary Waters, we discovered that one of the witnesses testifying was actually a lobbyist for a mining company.

This company would profit off of mining in the Boundary Waters, all while polluting and causing irreparable harm to the land. https://t.co/CnbQjnjWwh",2023-05-11 17:36:13+00:00
856,Rep. Alexandria Ocasio-Cortez,"Today during a committee hearing on the Boundary Waters, we discovered that one of the witnesses testifying was actually a lobbyist for a mining company.

This company would profit off of mining in the Boundary Waters, all while polluting and causing irreparable harm to the land. https://t.co/CnbQjnjWwh",2023-05-11 16:52:00+00:00
857,Alexandria Ocasio-Cortez,"“Making news” is not the same as covering news.

When one wishes to become a participant in events (ie. “making” news), they become the story and sacrifice the pretense of a neutral observer.

Also no one got answers. It was 70 mins of steamrolled propaganda, esp on abortion &amp; SA",2023-05-11 17:15:29+00:00
858,Brian Stelter,"""You do not have to like the former president's answers, but you can't say that we didn't get them,"" Licht tells staffers, many of whom are angry about the town hall. ""Kaitlan pressed him again and again and made news. Made a LOT of news."" And ""that is our job.""",2023-05-11 13:05:09+00:00
859,Alexandria Ocasio-Cortez,"It was a disservice to democracy, but also a major harm for women, survivors, &amp; people who rely on repro rights.

CNN allowing sexual assault to be treated like a joke to an applauding audience is egregious. At this point it’s not abt Trump- we know him. It’s abt the programming",2023-05-11 17:22:30+00:00
860,Alexandria Ocasio-Cortez,"RT @mehdirhasan: I’m sorry, but this is just a brazen &amp; dangerous dereliction of journalistic duty. We’ve gone from CNN telling hosts not to refer to election denialism on air as ‘the big lie’ to now having election deniers pushing the big lie/2020 conspiracies without any pushback from the host!",2023-05-11 16:48:04+00:00
861,Mehdi Hasan,"I’m sorry, but this is just a brazen &amp; dangerous dereliction of journalistic duty. We’ve gone from CNN telling hosts not to refer to election denialism on air as ‘the big lie’ to now having election deniers pushing the big lie/2020 conspiracies without any pushback from the host!",2023-05-11 14:22:47+00:00
862,Aaron Rupar,"CNN follows up on the Trump town hall by interviewing GOP Rep. Brian Mast, an election denier who pushes the big lie with impunity during his interview https://t.co/b6tQUY40cI",2023-05-11 14:13:21+00:00
863,Alexandria Ocasio-Cortez,"Presenting: Team AOC's 2022 Unwrapped! 🎁

Ever wonder what your Representative has been up to? We're proud to share our annual report to constituents and supporters across the country!

Here's our 22 Wins for 2022🏆
Want to help for 2023? Share + sign up: https://t.co/0o7guZ7Hbm https://t.co/ucb6Hcd6Ai",2022-12-21 18:18:34+00:00
864,Alexandria Ocasio-Cortez,"RT @SenWhitehouse: Biden's right:
1. The one person who won’t take US default off the table is Speaker McCarthy.
2. The House ransom bill is preposterous — recession and ~800k jobs lost.
3. McCarthy didn’t come to negotiate and likely can’t negotiate given MAGA extremists.

https://t.co/2MdHyRFsm7",2023-05-11 15:57:57+00:00
865,Sheldon Whitehouse,"Biden's right:
1. The one person who won’t take US default off the table is Speaker McCarthy.
2. The House ransom bill is preposterous — recession and ~800k jobs lost.
3. McCarthy didn’t come to negotiate and likely can’t negotiate given MAGA extremists.

https://t.co/2MdHyRFsm7",2023-05-11 14:58:21+00:00
866,Alexandria Ocasio-Cortez,"RT @lostblackboy: If you left your almost-full journal and a copy of Aurelius’ “Meditations” on the Q train, DM me so I can send them back to you. I know I’d be heartbroken if I lost my diary. https://t.co/sepWipfcjP",2023-05-11 03:03:16+00:00
867,Lil Uzi Hurt 🥺,"If you left your almost-full journal and a copy of Aurelius’ “Meditations” on the Q train, DM me so I can send them back to you. I know I’d be heartbroken if I lost my diary. https://t.co/sepWipfcjP",2023-05-11 02:24:40+00:00
868,Alexandria Ocasio-Cortez,"There is simply no way CNN can feign ignorance about the fact that they set up a sexual assault victim to be targeted and attacked on national television a day after the verdict.

People were sounding the alarm about this exact scenario. They let it happen anyway without a plan.",2023-05-11 02:51:20+00:00
869,Alexandria Ocasio-Cortez,"This, the choice to platform election disinformation, lies about January 6th, totally unchecked and reckless claims about abortion… they need to take ownership of what just happened.

This cannot be normalized. It’s dangerous.",2023-05-11 02:53:58+00:00
870,Alexandria Ocasio-Cortez,RT @atrupar: .@Lawrence points out that Kaitlan Collins failed to fact-check Trump's lies about abortion https://t.co/4ykT4g1I1Z,2023-05-11 02:20:22+00:00
871,Aaron Rupar,.@Lawrence points out that Kaitlan Collins failed to fact-check Trump's lies about abortion https://t.co/4ykT4g1I1Z,2023-05-11 02:15:18+00:00
872,Alexandria Ocasio-Cortez,"RT @RepAOC: ""What we saw tonight was a series of extremely irresponsible decisions that put a sexual abuse victim at risk...in front of a national audience, and I could not have disagreed with it more. It was shameful."" https://t.co/XvCAa9oDl4",2023-05-11 02:18:02+00:00
873,Rep. Alexandria Ocasio-Cortez,"""What we saw tonight was a series of extremely irresponsible decisions that put a sexual abuse victim at risk...in front of a national audience, and I could not have disagreed with it more. It was shameful."" https://t.co/XvCAa9oDl4",2023-05-11 02:06:02+00:00
874,Alexandria Ocasio-Cortez,"RT @atrupar: AOC on CNN's Trump town hall: ""I know you said earlier that you will not comment on the platforming of such atrocious disinformation, but I would. I think it was a profoundly irresponsible decision ... it was shameful."" https://t.co/XIVZJmM8nC",2023-05-11 01:45:13+00:00
875,Aaron Rupar,"AOC on CNN's Trump town hall: ""I know you said earlier that you will not comment on the platforming of such atrocious disinformation, but I would. I think it was a profoundly irresponsible decision ... it was shameful."" https://t.co/XIVZJmM8nC",2023-05-11 01:35:46+00:00
876,Alexandria Ocasio-Cortez,"RT @ClaraJeffery: ""You could kill the baby at 9 months or after it was born""

Goes unchallenged.

This a journalistic abomination.",2023-05-11 00:49:35+00:00
877,Clara Jeffery,"""You could kill the baby at 9 months or after it was born""

Goes unchallenged.

This a journalistic abomination.",2023-05-11 00:38:47+00:00
878,Alexandria Ocasio-Cortez,"CNN should be ashamed of themselves.

They have lost total control of this “town hall” to again be manipulated into platforming election disinformation, defenses of Jan 6th, and a public attack on a sexual abuse victim.

The audience is cheering him on and laughing at the host.",2023-05-11 00:23:37+00:00
879,Alexandria Ocasio-Cortez,This falls squarely on CNN. Everyone here saw exactly what was going to happen. Instead they put a sexual abuse victim in harm’s way for views. This was a choice to platform lies about the election &amp; Jan 6th w/ no plan but to have their moderator interrupted without consequence.,2023-05-11 00:34:46+00:00
880,Alexandria Ocasio-Cortez,RT @errollouis: The NYPD Is Greeting Vigils for Jordan Neely With Brute Force https://t.co/NsPcaBvDiV,2023-05-10 17:19:53+00:00
881,Errol Louis,The NYPD Is Greeting Vigils for Jordan Neely With Brute Force https://t.co/NsPcaBvDiV,2023-05-09 22:23:56+00:00
882,Alexandria Ocasio-Cortez,RT @ae53: The incredible thing about #BuildPublicRenewables is it was never a given. Everyone from the Governor to NYPA was against it at first. So why is everyone supportive now? Because organizers changed the conditions. Here’s how we won the biggest Green New Deal policy in the US🧵,2023-05-10 17:19:25+00:00
883,Aaron Eisenberg,The incredible thing about #BuildPublicRenewables is it was never a given. Everyone from the Governor to NYPA was against it at first. So why is everyone supportive now? Because organizers changed the conditions. Here’s how we won the biggest Green New Deal policy in the US🧵,2023-05-10 14:44:51+00:00
884,Alexandria Ocasio-Cortez,"RT @brianstelter: Michael Fanone is currently a CNN contributor. And he's speaking out against CNN's Trump town hall. ""I don't believe for one second that this is about journalistic integrity. It's about ratings and money"" https://t.co/SMlteLikFN https://t.co/dFZpmFRikV",2023-05-10 17:10:11+00:00
885,Brian Stelter,"Michael Fanone is currently a CNN contributor. And he's speaking out against CNN's Trump town hall. ""I don't believe for one second that this is about journalistic integrity. It's about ratings and money"" https://t.co/SMlteLikFN https://t.co/dFZpmFRikV",2023-05-10 15:58:29+00:00
886,Alexandria Ocasio-Cortez,"RT @HelenGymPHL: I’m honored to welcome @BernieSanders and @AOC to Philadelphia on Sunday.

This rally is all about joy, possibility, and people power, and that’s the energy we’re bringing with us into Election Day.

Hope you will join us! https://t.co/v61O42AW0O",2023-05-10 17:03:14+00:00
887,Helen Gym,"I’m honored to welcome @BernieSanders and @AOC to Philadelphia on Sunday.

This rally is all about joy, possibility, and people power, and that’s the energy we’re bringing with us into Election Day.

Hope you will join us! https://t.co/v61O42AW0O",2023-05-10 13:18:35+00:00
888,Alexandria Ocasio-Cortez,"RT @JuddLegum: The audience for the CNN townhall w/Trump will be 400 Republicans &amp; GOP-leaning independents

Allowing Trump to appear in front of an audience exclusively comprised of people who are likely sympathetic to Trump -- and then turn over the questions to that group -- is irresponsible",2023-05-10 17:02:08+00:00
889,Judd Legum,"The audience for the CNN townhall w/Trump will be 400 Republicans &amp; GOP-leaning independents

Allowing Trump to appear in front of an audience exclusively comprised of people who are likely sympathetic to Trump -- and then turn over the questions to that group -- is irresponsible",2023-05-10 15:27:48+00:00
890,Alexandria Ocasio-Cortez,"RT @DarrigoMelanie: Republicans on the Senate Finance Committee are protecting Harlan Crow from turning over financial records about the money and gifts he's given to Clarence Thomas.

Harlan Crow is a donor to 10 of the 13 Republicans on that committee.

That's corruption.
https://t.co/yPVDWtbtMu",2023-05-10 16:58:04+00:00
891,Melanie D'Arrigo,"Republicans on the Senate Finance Committee are protecting Harlan Crow from turning over financial records about the money and gifts he's given to Clarence Thomas.

Harlan Crow is a donor to 10 of the 13 Republicans on that committee.

That's corruption.
https://t.co/yPVDWtbtMu",2023-05-09 17:58:09+00:00
892,Alexandria Ocasio-Cortez,RT @nycsouthpaw: Justice Thomas changed his mind on an issue that’s very important to Harlan Crow and Leonard Leo—one that’s before the Court right now.  https://t.co/GjW6UFEmpn,2023-05-10 16:10:10+00:00
893,southpaw,Justice Thomas changed his mind on an issue that’s very important to Harlan Crow and Leonard Leo—one that’s before the Court right now.  https://t.co/GjW6UFEmpn,2023-05-10 12:13:08+00:00
894,Alexandria Ocasio-Cortez,"RT @SenWhitehouse: Looks like McCarthy came to White House to threaten default, not to negotiate. So much for wanting negotiations. Everybody else willing to take default off the table.",2023-05-10 15:13:44+00:00
895,Sheldon Whitehouse,"Looks like McCarthy came to White House to threaten default, not to negotiate. So much for wanting negotiations. Everybody else willing to take default off the table.",2023-05-10 14:47:30+00:00
896,Alexandria Ocasio-Cortez,"Like I said last week:

Twitter, brought to you by MyPillow (and only MyPillow)",2023-05-09 21:43:57+00:00
897,Matthew Gertz,Twitter's already wary advertisers are going to looooove paying to have their brands associated with Tucker Carlson.,2023-05-09 21:25:54+00:00
898,Alexandria Ocasio-Cortez,"RT @ElieNYC: CNN is going to cancel the town hall instead of platforming a sexual predator, right? RIGHT? [/sweet summer child sarcasm off]",2023-05-09 20:58:32+00:00
899,Elie Mystal,"CNN is going to cancel the town hall instead of platforming a sexual predator, right? RIGHT? [/sweet summer child sarcasm off]",2023-05-09 19:31:45+00:00
900,Alexandria Ocasio-Cortez,"Presenting: Team AOC's 2022 Unwrapped! 🎁

Ever wonder what your Representative has been up to? We're proud to share our annual report to constituents and supporters across the country!

Here's our 22 Wins for 2022🏆
Want to help for 2023? Share + sign up: https://t.co/0o7guZ7Hbm https://t.co/ucb6Hcd6Ai",2022-12-21 18:18:34+00:00
901,Alexandria Ocasio-Cortez,"A safer city is one with fewer people suffering from homelessness - not because they’ve been displaced, but because they have been housed.

 https://t.co/i5O5oGLHOx",2023-05-09 20:49:09+00:00
902,Alexandria Ocasio-Cortez,RT @GavinNewsom: This is your reminder that @GregAbbott_TX cut $211 million in mental health funding.,2023-05-08 22:51:23+00:00
903,Gavin Newsom,This is your reminder that @GregAbbott_TX cut $211 million in mental health funding.,2023-05-07 04:15:45+00:00
904,Alexandria Ocasio-Cortez,RT @mehdirhasan: It’s from the Trump presidency!!,2023-05-08 22:51:08+00:00
905,Mehdi Hasan,It’s from the Trump presidency!!,2023-05-08 14:04:11+00:00
906,Shayan Sardarizadeh,"This image is going viral today, shared by former NYPD Commissioner Bernard Kerik and others.

The image isn't current. It's from 2018 and shows Honduran migrants in Arriaga, Mexico, heading to the US. https://t.co/8lO8UX7FUd",2023-05-08 13:17:17+00:00
907,Alexandria Ocasio-Cortez,"RT @SenWhitehouse: This ethics scandal isn’t going away; I believe regular federal judges are upset and know they could never get away with this nonsense; and the Judicial Conference is an avenue for reform.

https://t.co/8vdFgEdUhx",2023-05-08 17:43:05+00:00
908,Sheldon Whitehouse,"This ethics scandal isn’t going away; I believe regular federal judges are upset and know they could never get away with this nonsense; and the Judicial Conference is an avenue for reform.

https://t.co/8vdFgEdUhx",2023-05-08 17:33:00+00:00
909,Alexandria Ocasio-Cortez,"RT @hollywood_labor: Thank you for the shoutout, @AOC! 

Folks can visit https://t.co/2kg6G1WdZU to support @WGAWest and @WGAEast workers on strike with food, snacks, coffee and more on the picket line! 

Visit https://t.co/MMTDkOU0nG to get updates on strike schedules! https://t.co/km3lqnDsLF",2023-05-08 17:42:19+00:00
910,DSA-LA's Hollywood Labor,"Thank you for the shoutout, @AOC! 

Folks can visit https://t.co/2kg6G1WdZU to support @WGAWest and @WGAEast workers on strike with food, snacks, coffee and more on the picket line! 

Visit https://t.co/MMTDkOU0nG to get updates on strike schedules! https://t.co/km3lqnDsLF",2023-05-06 18:40:33+00:00
911,Alexandria Ocasio-Cortez,"Republicans keep blaming mass shootings on mental health, but then defend the killing of the mentally ill too.",2023-05-07 04:12:59+00:00
912,Alexandria Ocasio-Cortez,RT @SummerForPA: They don't even give pretend thoughts and prayers anymore. They just put on their assualt rifle lapel pins and go about their day.,2023-05-07 00:25:20+00:00
913,Summer Lee,They don't even give pretend thoughts and prayers anymore. They just put on their assualt rifle lapel pins and go about their day.,2023-05-07 00:19:39+00:00
914,Alexandria Ocasio-Cortez,"Watching media give the Brock Turner treatment for the killing of a homeless man has been nauseating.

A person having a record does not excuse killing them. Neither does being poor, sick, or homeless.

Virtually every one of us is closer to being in Neely’s shoes than we think.",2023-05-06 23:57:12+00:00
915,Alexandria Ocasio-Cortez,"Our country criminalizes poverty and homelessness while making it impossible to afford rent on a minimum wage job. Our system is built for arresting the poor.

When the wealthy break the law, they rarely get records. They can afford to be treated favorably. Most of us cannot.",2023-05-07 00:12:29+00:00
916,Alexandria Ocasio-Cortez,"RT @tarapalmeri: I obtained leaked audio of a call between No Labels and it's supporters, in which the CEO tells a caller concerned about Harlan Crow's donations to the dark money group -- ""This isn't the place for you""

https://t.co/VdYXlPqWB2",2023-05-06 23:42:42+00:00
917,Tara Palmeri,"I obtained leaked audio of a call between No Labels and it's supporters, in which the CEO tells a caller concerned about Harlan Crow's donations to the dark money group -- ""This isn't the place for you""

https://t.co/VdYXlPqWB2",2023-05-05 15:55:34+00:00
918,Alexandria Ocasio-Cortez,"RT @MarkHarrisNYC: Things are not canceled because of the WGA strike. Things are canceled because networks, studios, and streamers are not fairly compensating writers for their work.",2023-05-06 17:53:27+00:00
919,Mark Harris,"Things are not canceled because of the WGA strike. Things are canceled because networks, studios, and streamers are not fairly compensating writers for their work.",2023-05-06 04:34:55+00:00
920,Alexandria Ocasio-Cortez,At this rate he’s gonna be begging for MyPillow ad buys in no time,2023-05-06 17:21:54+00:00
921,Aaron Rupar,Elon Musk is out here posting crude racism on main https://t.co/SPzVhSiPCz,2023-05-06 15:15:01+00:00
922,Alexandria Ocasio-Cortez,RT @SIfill_: The opening of this important piece by @errollouis gets it right and turns the mirror where it belongs. https://t.co/pSKxxfXTs4,2023-05-06 17:13:08+00:00
923,Sherrilyn Ifill,The opening of this important piece by @errollouis gets it right and turns the mirror where it belongs. https://t.co/pSKxxfXTs4,2023-05-06 13:35:56+00:00
924,New York Magazine,New York reckons with a homeless epidemic and a killing. https://t.co/O45h7B6Eb4,2023-05-06 12:11:41+00:00
925,Alexandria Ocasio-Cortez,"Despite what Fox News wants you to believe, being afraid of an unarmed person is not a reason to kill them.

We should never accept a society where such rationale becomes normal. 

Especially when powerful incentives exist in politics + media to keep people afraid of each other.",2023-05-06 15:08:33+00:00
926,Alexandria Ocasio-Cortez,"This is corruption. Plain and simple. And each day that passes, the Supreme Court is looking less like a bench and more like an auction house.

Thomas should resign immediately and Roberts should see to it that he does.",2023-05-05 02:13:18+00:00
927,The Washington Post,"Exclusive: Conservative judicial activist Leonard Leo arranged for the wife of Supreme Court Justice Clarence Thomas to be paid tens of thousands of dollars for consulting work nearly a decade ago, specifying that her name be left off billing paperwork. https://t.co/CKc8KwbEoh https://t.co/mrKkHpGpDk",2023-05-04 23:22:10+00:00
928,Alexandria Ocasio-Cortez,"People w/ mental health conditions make up 53% of the population at Rikers.

On average, they are held 61% longer.

We pay $556,000 per person annually to keep them in jail. 90% on Rikers are held without conviction.

By contrast, it costs ~$42k to put them in supportive housing.",2023-05-04 17:46:38+00:00
929,Alexandria Ocasio-Cortez,https://t.co/3nnK2jMCiQ,2023-05-04 17:46:38+00:00
930,Alexandria Ocasio-Cortez,https://t.co/hwkgVx2uqg.,2023-05-04 17:46:47+00:00
931,Alexandria Ocasio-Cortez,"RT @OliviaMesser: It’s a political act and a personal sacrifice of incredible proportions to invite public discourse into your trauma. There’s no amount of money that would make it worth it. The personal is political; a sacrifice like this has implications for the country, other women, the world.",2023-05-09 19:56:49+00:00
