,Name,Text,Time
590,Joe Biden,"We've helped create over 13 million new jobs, including over 800,000 manufacturing jobs.
The unemployment rate has remained below 4% for 17 months.
Inflation has come down by more than half.

It's no mistake—Bidenomics is working.",2023-07-15 17:43:00+00:00
591,Joe Biden,"13.2 million jobs have been added since I took office.
Unemployment is near historic lows.
Wages are rising.

More jobs and lower costs: That’s Bidenomics.",2023-07-15 00:24:00+00:00
592,Joe Biden,This campaign is powered by grassroots donors. https://t.co/WAABaB1twv,2023-07-14 22:56:05+00:00
593,Temu,"Up to 90% off. Shop smarter, save bigger with our deals.",2023-12-01 14:34:52+00:00
594,Joe Biden,"I’m proud to say that Team Biden-Harris has raised more than $72 million since April.

To all the grassroots donors who pitched in a few bucks at a time—thank you. This campaign is powered by you. And with your help, we’re going to finish the job.",2023-07-14 19:15:03+00:00
595,Joe Biden,"RT @JulieR2022: NEW: Team @JoeBiden has raised over $72M.

Grassroots donors are powering our campaign, helping us build a strong foundation to win in 2024. That’s why the most impactful thing you can do right now is sign up to give a $20 recurring gift: https://t.co/pFh7VCynrb https://t.co/i5n9ZjXklC",2023-07-14 14:08:21+00:00
596,Julie Chavez Rodriguez,"NEW: Team @JoeBiden has raised over $72M.

Grassroots donors are powering our campaign, helping us build a strong foundation to win in 2024. That’s why the most impactful thing you can do right now is sign up to give a $20 recurring gift: https://t.co/pFh7VCynrb https://t.co/i5n9ZjXklC",2023-07-14 14:07:30+00:00
597,Ancient Origins,Find out your Ancient DNA today. Affordable and highly accurate test to show your true ancient origins. 🧬,2023-10-18 16:19:59+00:00
598,Joe Biden,.@KamalaHarris and I are ready to finish the job. https://t.co/13U6ZHVCWD,2023-07-13 22:13:01+00:00
599,Joe Biden,"RT @POTUS: When Russian bombs began to fall, the United States did not hesitate to act. 
 
We rallied the world to support the brave people of Ukraine as they defend their liberty and their very sovereignty. https://t.co/D2462qc7oX",2023-07-13 17:20:22+00:00
600,President Biden,"When Russian bombs began to fall, the United States did not hesitate to act. 
 
We rallied the world to support the brave people of Ukraine as they defend their liberty and their very sovereignty. https://t.co/D2462qc7oX",2023-07-13 17:15:43+00:00
601,Joe Biden,"We're investing over $2 billion to modernize our electric grid to be more climate resilient.

That funding will help ensure our electric grid is stronger and that the lights, air conditioning, and internet stay on during heat waves, storms, and other climate events.",2023-07-13 14:25:01+00:00
602,Joe Biden,"Real wages for the average American worker are now higher than they were before the pandemic—with lower wage workers seeing the largest gains.

This is no accident. It’s Bidenomics in action. https://t.co/6jlfQKcmd7",2023-07-13 00:20:05+00:00
603,Joe Biden,"RT @POTUS: Even after all of this time, Putin doubts our staying power.

He’s making his bad bet that the unity among the U.S. and our Allies and partners will break down.

He doesn’t understand that our commitment to freedom is something we will never walk away from – it's who we are.",2023-07-12 21:24:22+00:00
604,President Biden,"Even after all of this time, Putin doubts our staying power.

He’s making his bad bet that the unity among the U.S. and our Allies and partners will break down.

He doesn’t understand that our commitment to freedom is something we will never walk away from – it's who we are.",2023-07-12 20:35:00+00:00
605,Joe Biden,It’s time for Congress to codify Roe v. Wade once and for all.,2023-07-12 19:38:00+00:00
606,Joe Biden,"Today we learned that annual inflation has fallen each of the last twelve months and is now down to 3%.

We’ve made this progress while unemployment remains near record lows. 

That’s Bidenomics in action.",2023-07-12 15:07:07+00:00
607,Joe Biden,RT @POTUS: Tune in as I deliver remarks alongside G7 leaders to announce a new Joint Declaration of Support for Ukraine. https://t.co/SowVb23mvt,2023-07-12 13:26:43+00:00
608,President Biden,Tune in as I deliver remarks alongside G7 leaders to announce a new Joint Declaration of Support for Ukraine. https://t.co/SowVb23mvt,2023-07-12 13:24:14+00:00
609,Joe Biden,"Since I’ve been in office, we’ve created more jobs than any president has created in their first two years. https://t.co/OUZxtYmO4w",2023-07-11 21:58:51+00:00
610,Joe Biden,"RT @POTUS: The United States is here today to reaffirm our ironclad commitment to NATO, but also to our Ally Lithuania.
 
Our partnership goes back a long way. And our commitment to Lithuania, to the Baltics, and to NATO has not wavered. https://t.co/0B0zKeqG83",2023-07-11 20:10:57+00:00
611,President Biden,"The United States is here today to reaffirm our ironclad commitment to NATO, but also to our Ally Lithuania.
 
Our partnership goes back a long way. And our commitment to Lithuania, to the Baltics, and to NATO has not wavered. https://t.co/0B0zKeqG83",2023-07-11 15:13:22+00:00
612,Joe Biden,"Junk fees cost hundreds of dollars a month, weighing down family budgets and making it harder for people to pay their bills. That's why we're cracking down on junk fees for concerts, hotels, airlines, banking, health care, and more.",2023-07-11 15:06:05+00:00
613,Joe Biden,"Big Pharma is suing our administration to block us from negotiating lower prescription drug prices so they can pad their profits while hardworking Americans foot the bill.

But we won’t give in. We’re going to keep standing up to Big Pharma.",2023-07-10 21:41:01+00:00
614,Joe Biden,RT @POTUS: It was an honor meeting with His Majesty this morning for a wide-ranging discussion on the global challenges facing our nations. https://t.co/KBybKVrnkF,2023-07-10 19:28:20+00:00
615,President Biden,It was an honor meeting with His Majesty this morning for a wide-ranging discussion on the global challenges facing our nations. https://t.co/KBybKVrnkF,2023-07-10 18:05:02+00:00
616,Denison Forum: News Discerned Differently,"In a love letter written to Rosalynn 75 years ago, when former president Jimmy Carter was serving in the Navy, it said in part, “When I see you, I fall in love with you all over again. Does that seem strange to you? It doesn’t to me.”",2023-11-29 12:20:00+00:00
617,Joe Biden,"The Republican Study Committee, which includes over three-quarters of the House Republicans, just released a plan trying to repeal the Inflation Reduction Act again. 

It hasn’t stopped them from claiming credit now that billions of dollars and thousands of jobs are coming to the United States.",2023-07-10 15:21:56+00:00
618,Joe Biden,"Growing the economy by creating jobs.
Lowering costs for hardworking families
Making smart investments in America.

That’s Bidenomics.",2023-07-09 22:47:00+00:00
619,Joe Biden,"This week, we issued a new rule to crack down on health insurance plans that seem inexpensive but stick consumers with hidden fees.

Under our rule, short-term plans must be four months or less, and insurance companies must provide a disclaimer about what is and is not covered. https://t.co/ZfSXRdFnQL",2023-07-09 20:17:05+00:00
620,Joe Biden,"When you invest in America and strengthen the middle class, we see stronger economic growth that benefits everybody. https://t.co/iHVkBBguhI",2023-07-09 15:31:24+00:00
621,Joe Biden,"Bidenomics is working. 

Factories are being built, jobs are being created, and it’s happening all across America in communities that have been left out and hollowed out.",2023-07-08 23:04:00+00:00
622,Temu,Enjoy the best deal and free shipping on your first order.,2023-11-29 14:25:54+00:00
623,Joe Biden,"The unemployment rate has remained below 4% for 17 months—the longest stretch since the 1960s. The share of working-age Americans with jobs is the highest in over 20 years. Inflation has come down by more than half. 

We are seeing stable and steady growth. That’s Bidenomics.",2023-07-08 20:30:01+00:00
624,Joe Biden,"From including funding for after-school and summer programs to hiring more teachers, counselors, and school psychologists, our American Rescue Plan helped deliver critical support for schools.",2023-07-08 16:22:00+00:00
625,Joe Biden,"The rate of Americans without health insurance is at an all-time low. Premiums under the Affordable Care Act are $800 less per person than before I took office.

We’re protecting consumers and reducing health care costs without hurting insurance companies, doctors, or hospitals.",2023-07-08 14:40:00+00:00
626,Joe Biden,"As women’s health is under attack across the country, contraception is more important than ever. 

That’s why I’ve signed a third reproductive health care executive order that strengthens access to affordable, high-quality contraception—an essential part of reproductive care. https://t.co/LPlnBQjL7c",2023-07-07 21:00:11+00:00
627,Joe Biden,"This is Bidenomics in action: Our economy added more than 200,000 jobs last month—for a total of 13.2 million jobs since I took office. 

That’s more jobs added in two and a half years than any president has ever created in a four-year term.",2023-07-07 18:16:58+00:00
628,Joe Biden,"I believe that every American willing to work hard should be able to raise their kids on a good paycheck and keep their roots where they grew up. 

That's the American dream. That’s Bidenomics. https://t.co/gLquZdrN0B",2023-07-07 16:30:09+00:00
629,Joe Biden,"Congress needs to step up and pass common-sense gun safety laws to protect our kids and educators. 

Arming teachers is not the answer. Banning assault weapons and high-capacity magazines, and ensuring extensive background checks are part of the answer.",2023-07-06 22:31:00+00:00
630,Joe Biden,"Under Bidenomics, Americans who had been on the sidelines are back to work.

We’re going to build on this progress by ensuring every American has the training and education to participate in this new economy. https://t.co/ggrImiw55N",2023-07-06 17:00:19+00:00
631,Joe Biden,"Bidenomics is about the future. It’s rooted in what’s always worked best in this country: Investing in Americans. 

When we invest in our people, we strengthen the middle class and see the economy grow.",2023-07-06 15:30:04+00:00
632,Joe Biden,Bidenomics means the industries of the future are going to grow right here at home. We've already had $490 billion in private investment commitments from U.S. companies and companies coming to America.,2023-07-06 14:15:35+00:00
633,Joe Biden,"Bidenomics is about growing the economy from the middle out and the bottom up, not from the top down.

That's in clear contrast to the MAGA economic vision for America. https://t.co/aeo4dFbsgs",2023-07-06 00:35:26+00:00
634,Joe Biden,"Our military families represent a link in the chain of honor that stretches back to our founding days. 

You are the backbone of why we are who we are. 

Unbreaking. Unbending. https://t.co/e14MeXHPpf",2023-07-05 20:39:08+00:00
635,Joe Biden,"RT @POTUS: This week, our nation has again endured a wave of tragic shootings — just as we mark one year since the tragedy in Highland Park, Illinois.

Jill and I grieve for those lost, and as our nation celebrates Independence Day, we pray for the day when we’ll be free from gun violence.",2023-07-04 18:16:54+00:00
636,President Biden,"This week, our nation has again endured a wave of tragic shootings — just as we mark one year since the tragedy in Highland Park, Illinois.

Jill and I grieve for those lost, and as our nation celebrates Independence Day, we pray for the day when we’ll be free from gun violence.",2023-07-04 17:39:14+00:00
637,Joe Biden,"As we celebrate our nation this Fourth of July, I’m thinking of the countless service members who sacrifice so much to keep us safe.

We will always be in debt to those who defend our nation and democracy around the world. https://t.co/DgWDpq1Ny5",2023-07-04 15:00:21+00:00
638,Joe Biden,"RT @POTUS: Happy Fourth, America. https://t.co/dJmLP8oxkt",2023-07-04 13:49:02+00:00
639,President Biden,"Happy Fourth, America. https://t.co/dJmLP8oxkt",2023-07-04 13:26:05+00:00
640,Joe Biden,"We’ve helped create millions of new jobs, passed historic legislation to lower costs for families, and seen millions of small businesses applications across the country—all while the unemployment rate has remained at historic lows.

Let’s keep it going. https://t.co/txcon9XoVW",2023-07-03 22:03:05+00:00
641,Joe Biden,"Cracking down on junk fees is about transparency, which leads to more competition, brings down costs for working Americans, and keeps growing our economy from the bottom up and the middle out, not the top down.",2023-07-03 15:32:01+00:00
642,Joe Biden,"While my Investing in America agenda is creating clean energy jobs right here in America, House Republicans are proposing a plan to ship these jobs overseas. All while giving hundreds of billions of dollars in tax breaks to big corporations.",2023-07-03 00:19:00+00:00
643,Joe Biden,We are committed to working with our federal enforcement agencies to rigorously enforce federal laws that protect Americans from discrimination based on gender identity or sexual orientation.,2023-07-02 15:26:00+00:00
644,Joe Biden,"The hypocrisy of Republican elected officials is stunning. 

They had no problem with billions in pandemic-related business loans, including to their own businesses. But when it came to providing relief to millions of hard-working Americans, they did everything to stop it.",2023-07-01 21:12:15+00:00
645,Temu,Car Phone Holder: It's a must-have for hands-free driving,2023-11-30 03:36:42+00:00
646,Joe Biden,"With a combination of the Bipartisan Infrastructure Law, the Inflation Reduction Act, and the CHIPS and Science Act, we’ve invested more than $50 billion in climate resilience so far.",2023-07-01 17:20:00+00:00
647,Joe Biden,Republican hypocrisy on student debt relief is stunning. https://t.co/t8SZBuzT9D,2023-07-01 15:20:26+00:00
648,Joe Biden,"RT @POTUS: By freeing millions of Americans from the crushing burden of student debt:

More homes would have been bought.
More businesses would have been started.
More couples would have had the confidence to start families.

The Republican elected officials who sued us blocked all of it.",2023-07-01 14:32:48+00:00
649,President Biden,"By freeing millions of Americans from the crushing burden of student debt:

More homes would have been bought.
More businesses would have been started.
More couples would have had the confidence to start families.

The Republican elected officials who sued us blocked all of it.",2023-07-01 01:30:00+00:00
650,Joe Biden,"As millions of Americans joined together to celebrate Pride month, the Supreme Court’s disappointing decision in 303 Creative LLC v. Elenis undermines the basic truth that no person should face discrimination simply because of who they are or who they love.

We will accelerate our march towards full equality for every American.",2023-07-01 01:16:51+00:00
651,Joe Biden,"RT @POTUS: Some of the same elected Republicans who voted to overturn my student loan relief plan benefitted from thousands in pandemic relief loans to keep their own businesses open.

Those loans were forgiven.

Now, they refuse to extend the same relief to borrowers with student debt.",2023-07-01 01:09:46+00:00
652,President Biden,"Some of the same elected Republicans who voted to overturn my student loan relief plan benefitted from thousands in pandemic relief loans to keep their own businesses open.

Those loans were forgiven.

Now, they refuse to extend the same relief to borrowers with student debt.",2023-06-30 23:15:00+00:00
653,Joe Biden,"We’re announcing a new path to provide student debt relief to as many borrowers as possible, as quickly as possible. https://t.co/jlvB86qM7h",2023-06-30 23:31:26+00:00
654,Joe Biden,"RT @POTUS: Today, the Supreme Court sided with Republican elected officials, blocking relief to over 40 million working and middle-class Americans.

I believe the Court’s decision is wrong – I will not stop fighting to deliver relief to borrowers who need it the most.",2023-06-30 20:09:57+00:00
655,President Biden,"Today, the Supreme Court sided with Republican elected officials, blocking relief to over 40 million working and middle-class Americans.

I believe the Court’s decision is wrong – I will not stop fighting to deliver relief to borrowers who need it the most.",2023-06-30 20:08:52+00:00
656,Joe Biden,"RT @POTUS: Unthinkable.

This fight isn’t over. I’ll have more to announce when I address the nation this afternoon.",2023-06-30 16:45:09+00:00
657,President Biden,"Unthinkable.

This fight isn’t over. I’ll have more to announce when I address the nation this afternoon.",2023-06-30 16:43:31+00:00
658,The New York Times,"Breaking News: The Supreme Court struck down the Biden administration’s student loan forgiveness plan on Friday, a resounding setback for tens of millions of borrowers. The ruling also imposes new restrictions on presidential power. Follow live updates. https://t.co/mrgYg9yy9s https://t.co/iHMcvaodN5",2023-06-30 14:52:19+00:00
659,Joe Biden,"Thanks, @BarackObama. 

Chip in $5 before midnight→ https://t.co/AUgU2Gnqqb https://t.co/gYyyseYQLF",2023-06-30 12:50:00+00:00
660,Joe Biden,Here are 5 reasons why my friend @BarackObama thinks you should donate $5 to my campaign today: https://t.co/AUgU2Gnqqb. https://t.co/xxqEHDQRt7,2023-06-29 23:28:00+00:00
661,Joe Biden,"Today, I'm directing the Department of Education to analyze what practices helped build more inclusive and diverse student bodies and what practices hold that back. 

Colleges should continue to support, retain, and graduate diverse students and classes.",2023-06-29 20:45:02+00:00
662,Joe Biden,"Diversity is our strength, and we will find a way forward. https://t.co/gjuKQq9Fv6",2023-06-29 20:05:37+00:00
663,Joe Biden,"RT @POTUS: For decades, the Supreme Court recognized a college’s freedom to decide how to build a diverse student body and provide opportunity.

Today, the Court walked away from precedent, effectively ending affirmative action in higher education.

I strongly disagree with this decision.",2023-06-29 17:03:32+00:00
664,President Biden,"For decades, the Supreme Court recognized a college’s freedom to decide how to build a diverse student body and provide opportunity.

Today, the Court walked away from precedent, effectively ending affirmative action in higher education.

I strongly disagree with this decision.",2023-06-29 16:51:06+00:00
665,Joe Biden,RT @POTUS: Tune in as I deliver remarks on the Supreme Court’s decision on affirmative action in higher education. https://t.co/Vj8ox53g6v,2023-06-29 16:49:17+00:00
666,President Biden,Tune in as I deliver remarks on the Supreme Court’s decision on affirmative action in higher education. https://t.co/Vj8ox53g6v,2023-06-29 16:35:43+00:00
667,Joe Biden,That’s Bidenomics. https://t.co/z0FnSk9ccY,2023-06-29 01:14:39+00:00
668,Joe Biden,"Thanks guys – I think we can make it happen. 

Pitch in here before the end-of-quarter deadline: https://t.co/ZBDw4fKAA9",2023-06-29 00:20:00+00:00
669,Chris Murphy 🟧,"Hey @CoryBooker @brianschatz time to get the gang back together - for @JoeBiden! 

His team asked us to raise $100K on Twitter this week before the Friday end of quarter deadline.

We can do it! Let’s send a message to Trump that we are ready. Chip in!
https://t.co/sqgagxr9Is",2023-06-28 12:11:10+00:00
670,Joe Biden,"Today, the U.S. has the highest economic growth rate among the world’s leading economies since the pandemic. We’ve created 13.4 million jobs—more jobs in two years than any president has added in a four-year term.
​
Folks, that’s no accident. That’s Bidenomics in action. https://t.co/k31njQmavW",2023-06-28 21:50:06+00:00
671,Joe Biden,"We’re creating jobs.
We’re lowering costs.

Bidenomics is about growing the economy from the bottom up and middle out, not the top down. https://t.co/zm7wxoDzsb",2023-06-28 19:37:05+00:00
672,Joe Biden,RT @POTUS: Join me in Chicago as I deliver remarks on my plan to grow the economy from the middle out and bottom up. https://t.co/svjqJ2nB0D,2023-06-28 17:04:09+00:00
673,President Biden,Join me in Chicago as I deliver remarks on my plan to grow the economy from the middle out and bottom up. https://t.co/svjqJ2nB0D,2023-06-28 16:58:21+00:00
674,Joe Biden,"Over 13 million new jobs created.
More Americans are working than ever.
Record number of small business applications.

Bidenomics is growing our economy.",2023-06-28 16:56:01+00:00
675,Temu,Up to 90% off. Get ready to elevate your shopping experience.,2023-12-01 14:13:20+00:00
676,Joe Biden,"Bidenomics is working.

The unemployment rate has been under 4% for 16 months in a row. The last time our nation had such a long stretch of low unemployment was in the 1960s. https://t.co/kDA7CYIB4c",2023-06-28 14:45:09+00:00
677,Joe Biden,"Under Bidenomics, we’re creating union jobs at home and exporting products abroad, all while cutting the deficit.",2023-06-28 13:30:27+00:00
678,Joe Biden,"If somehow Congress were to pass a national abortion ban, I will veto it. https://t.co/c07oaTLgaT",2023-06-28 00:30:29+00:00
679,Joe Biden,"For today's economy to work for everyone, internet access is just as important as electricity, water, or other basic services.

That's why we're making equally historic investments to connect everyone in America to affordable high-speed internet. https://t.co/qrfVtoqrl8",2023-06-27 21:05:06+00:00
680,Joe Biden,"The Inflation Reduction Act includes $369 billion to combat climate change. From day one, we’ve been working to reduce our carbon emissions. 

Thanks to the historic law, by 2030, we’ll be reducing emissions by 1 billion tons a year.",2023-06-27 16:19:18+00:00
681,Joe Biden,"Some MAGA Republicans in Congress are trying to undo the progress we made in our first two and a half years. They were holding the country hostage over the debt limit unless I would gut the climate provisions in the Inflation Reduction Act. 

I didn't let it happen.",2023-06-27 00:43:00+00:00
682,Joe Biden,"House Republicans are proposing a GOP Tax Scam 2.0 that would spend hundreds of billions of dollars on tax breaks for big corporations—while shipping clean energy jobs overseas and raising energy costs on American families.

Their priorities are clear.",2023-06-26 23:09:00+00:00
683,Joe Biden,"Today, we announced over $40 billion to be distributed across the country to deliver high-speed internet to places with either no or slow service.

With this funding and other federal investments, we will connect every person in America to reliable, high-speed internet by 2030.",2023-06-26 21:49:00+00:00
684,Joe Biden,"The average billionaire in America pays 8% in federal taxes.

Teachers and firefighters pay more than that.

That’s why I proposed a minimum tax for billionaires. Republicans are against it, but I’m going to keep fighting for it.",2023-06-26 15:33:02+00:00
685,Joe Biden,"When @KamalaHarris and I were elected, we vowed to enact the most ambitious climate and environmental justice campaign in American history. That’s exactly what we’ve done.",2023-06-25 22:40:00+00:00
686,Joe Biden,"As a nation, we have many obligations, but we have only one truly sacred obligation: To prepare those we send into harm’s way and care for them and their families when they come home. https://t.co/Ij64GpLwSs",2023-06-25 14:30:07+00:00
687,Joe Biden,"After the Supreme Court's extreme decision to overturn Roe v. Wade, I signed an executive order to safeguard access to health care services like abortion and promote the safety and security of patients, providers, and clinics—but Congress must do more. https://t.co/3re4z4xoni",2023-06-24 22:30:05+00:00
688,Joe Biden,"The only way to stop those who are committed to taking away women’s rights and freedoms in every state is to elect a Congress that will pass a law restoring Roe v. Wade.

Vice President @KamalaHarris and I will continue to lead the fight to protect a woman’s right to an abortion. https://t.co/sHwsWV8dgb",2023-06-24 18:00:11+00:00
689,Joe Biden,"MAGA extremists have taken credit for killing Roe v. Wade and are lining up to take on our bedrock freedoms by dictating the health care decisions a woman can make.

We will never back down from protecting a woman’s right to choose. https://t.co/2E3uLTGDju",2023-06-24 14:40:23+00:00
690,Joe Biden,"RT @POTUS: One year ago, the Supreme Court took away a constitutional right from the American people, denying women the right to choose.

My Administration has taken swift and strong action – but the job isn't finished until Congress codifies the protections of Roe v. Wade once and for all. https://t.co/NjoQrW6Kj3",2023-06-24 13:44:11+00:00
691,President Biden,"One year ago, the Supreme Court took away a constitutional right from the American people, denying women the right to choose.

My Administration has taken swift and strong action – but the job isn't finished until Congress codifies the protections of Roe v. Wade once and for all. https://t.co/NjoQrW6Kj3",2023-06-24 13:43:11+00:00
692,Joe Biden,"Despite the will of the American people, MAGA Republicans made clear that they don't intend to stop with the Dobbs decision. 

Make no mistake about it: if Congress were to pass a national abortion ban, I will veto it.",2023-06-24 00:39:00+00:00
693,Joe Biden,It’s time to restore Roe v. Wade once and for all. https://t.co/clMks641a7,2023-06-23 23:15:19+00:00
