,Name,Text,Time
271,Joe Biden,"If we have a government shutdown, a lot of vital work in science and health could be impacted—from cancer research to food safety. 

The American people need House Republicans to do their job: fund the government.",2023-09-28 16:40:01+00:00
272,Joe Biden,That’s right. https://t.co/SI9hNEOEEJ,2023-09-28 13:32:00+00:00
273,Austin Scholar,"The worst thing you can do to your Kindergartener is…put them in Kindergarten. 

Our 100-year-old education system will dramatically curb your kid’s potential.

But, there's another option.

Follow me @austinscholar to learn more about it.",2023-10-16 18:47:27+00:00
274,Joe Biden,Couldn’t agree more.,2023-09-28 01:28:09+00:00
275,Biden-Harris HQ,DeSantis: “[Donald Trump] owes it to you to defend his record where they added 7.8 trillion to the debt. That set the stage for the inflation that we have now” https://t.co/ztIIWBzZhU,2023-09-28 01:27:26+00:00
276,Joe Biden,"Trump broke his promises to American workers. 
https://t.co/LsaJh9cNFb",2023-09-27 21:57:00+00:00
277,Joe Biden,"We’ve created a record 13.5 million new jobs since we came to office, Black unemployment is reaching historic lows, and Black small businesses are starting up at a faster rate than at any time in the last 25 years.",2023-09-27 20:10:23+00:00
278,Joe Biden,"You know, I agree with Mitch here. Why the House Republicans would want to defund Border Patrol is beyond me.",2023-09-27 18:41:02+00:00
279,Biden-Harris HQ,"McConnell: If Speaker McCarthy and House Republicans shut down the government, they are voting to defund border patrol https://t.co/LHBHSyZf0q",2023-09-27 17:15:00+00:00
280,Joe Biden,"Auto workers saved the automobile industry in 2008, and they made a lot of sacrifices when car companies were in trouble. 

Now, those companies are doing incredibly well—and these workers should be too. https://t.co/rN7jYjozix",2023-09-27 17:00:22+00:00
281,Joe Biden,"If the government shuts down, members of our military will be on duty but not get paid. 

It’s time for these extreme Republicans in the House to start doing the job America elected them to do. Let’s get it done.",2023-09-27 14:30:25+00:00
282,Temu,Up to 90% off. Why wait? Get your hands on our bestsellers.,2023-11-30 13:19:50+00:00
283,Blenfify,"🦉✨A symbol of wisdom, lucky, mystery, and timeless elegance.

🛒Get yours 👉 https://t.co/4KscnzUrPn https://t.co/hbVUqvHUW3",2023-11-21 10:32:02+00:00
284,Family Values of America,"Thank you to those who have signed the petition! Please continue to share it, to encourage those states that have not yet joined the ranks. https://t.co/Oy2vCi46xX

Call to Action #ohio #OH #WI #wisconsin Contact your Representatives and Tell them to protect our Children!",2023-12-01 19:20:40+00:00
285,Joe Biden,"We’ve invested over $7 billion in HBCUs, more than any time in American history.

A promise made and a promise kept.",2023-09-27 00:51:00+00:00
286,Joe Biden,"You've heard me say it many times:

Wall Street didn't build this country, the middle class did, and unions built the middle class. 

UAW workers deserve what they've earned, and they've earned a hell of a lot more than what they're getting paid now. https://t.co/iMtAVKDKCW",2023-09-26 22:57:36+00:00
287,Joe Biden,"We could be facing a government shutdown if Republicans in the House don’t do their job.

Speaker McCarthy and I came to an agreement on spending levels for the government a few months ago.

But now, House Republicans refuse to stand up to the extremists in their party—and everyone in America could be forced to pay the price.",2023-09-26 20:01:14+00:00
288,Joe Biden,"RT @POTUS: Record corporate profits should mean record contracts.

It's time American autoworkers got a fair deal. https://t.co/DN2IMbcuuh",2023-09-26 19:47:19+00:00
289,President Biden,"Record corporate profits should mean record contracts.

It's time American autoworkers got a fair deal. https://t.co/DN2IMbcuuh",2023-09-26 19:45:02+00:00
290,Joe Biden,"A government shutdown could impact everything from food safety to cancer research to Head Start programs for children.

Funding the government is one of the most basic responsibilities of Congress. 

It’s time for Republicans to start doing the job America elected them to do.",2023-09-26 00:23:00+00:00
291,Joe Biden,"I’m focused on things the American people want us to focus on: growing the economy, making more good jobs available, and lowering prescription drug prices.  

I encourage MAGA Republicans to join me. https://t.co/PNXNEJ14pF",2023-09-25 23:21:05+00:00
292,Joe Biden,"We have announced dozens of executive actions to reduce gun violence, from cracking down on ghost guns to breaking up gun trafficking and more. 

As we push for Congress to do more, the White House Office of Gun Violence Prevention will accelerate our work to save more lives. https://t.co/jGsQMY3OuP",2023-09-25 19:00:15+00:00
293,Joe Biden,"We overcame relentless opposition from the gun lobby, gun manufacturers, and many politicians against common sense gun legislation and passed the most significant gun safety bill in three decades.

We’re not stopping there: It’s time to ban assault weapons and high-capacity magazines.",2023-09-25 16:00:31+00:00
294,Joe Biden,"At this inflection point in history, we will be judged by whether or not we live up to the promises we made to those who will inherit the world we create.

The road ahead is long and difficult, but if we preserve, persevere, and prevail, we can deliver progress for everyone. https://t.co/CyH0wQkjVq",2023-09-24 16:45:06+00:00
295,Joe Biden,"RT @POTUS: As Jewish communities in the United States, Israel, and around the world observe Yom Kippur, Jill and I extend our best wishes on this sacred and solemn holiday.

We wish you a meaningful and easy fast. May we all be sealed in the Book of Life.
 
G’mar Chatimah Tova.",2023-09-24 13:52:44+00:00
296,President Biden,"As Jewish communities in the United States, Israel, and around the world observe Yom Kippur, Jill and I extend our best wishes on this sacred and solemn holiday.

We wish you a meaningful and easy fast. May we all be sealed in the Book of Life.
 
G’mar Chatimah Tova.",2023-09-24 13:14:06+00:00
297,Joe Biden,Donald Trump is responsible for extreme abortion bans nationwide—but don’t just take my word for it… https://t.co/gGx5xgRBzD,2023-09-23 23:30:26+00:00
298,Joe Biden,"We’re achieving the largest increases in Pell Grants in over a decade, fixing the Public Service Loan Forgiveness program, and creating the most generous Income-Driven Repayment plan in history, called SAVE.  

And we're not done getting student loan borrowers the relief they need to reach their dreams.",2023-09-23 21:09:42+00:00
299,Joe Biden,"If members of Congress refuse to act on gun violence, we need to elect new members of Congress who will. https://t.co/Ei7FoPXczV",2023-09-23 17:25:26+00:00
300,Joe Biden,RT @POTUS: Promise kept. https://t.co/JZcgFh8DSx,2023-09-22 23:18:34+00:00
301,President Biden,Promise kept. https://t.co/JZcgFh8DSx,2023-09-22 21:18:34+00:00
302,Joe Biden,"In the absence of sorely-needed Congressional action on gun violence, our Office of Gun Violence Prevention will continue to do everything it can to combat this epidemic that is tearing our families, our communities, and our country apart.",2023-09-22 22:21:00+00:00
303,Joe Biden,"RT @POTUS: Tuesday, I’ll go to Michigan to join the picket line and stand in solidarity with the men and women of UAW as they fight for a fair share of the value they helped create.

It’s time for a win-win agreement that keeps American auto manufacturing thriving with well-paid UAW jobs.",2023-09-22 20:59:48+00:00
304,President Biden,"Tuesday, I’ll go to Michigan to join the picket line and stand in solidarity with the men and women of UAW as they fight for a fair share of the value they helped create.

It’s time for a win-win agreement that keeps American auto manufacturing thriving with well-paid UAW jobs.",2023-09-22 20:56:21+00:00
305,Joe Biden,"I'm establishing the first-ever White House Office of Gun Violence Prevention, overseen by Vice President @KamalaHarris, to build upon our historic work to keep guns out of dangerous hands and Americans safe. https://t.co/8r4FVSbjiD",2023-09-22 18:00:20+00:00
306,Joe Biden,Yes. https://t.co/xgKhfKXBKa,2023-09-22 13:56:31+00:00
307,Joe Biden,"RT @POTUS: Because thoughts and prayers are not enough.
 
@VP and I just created the first White House Office of Gun Violence Prevention.",2023-09-22 13:34:59+00:00
308,President Biden,"Because thoughts and prayers are not enough.
 
@VP and I just created the first White House Office of Gun Violence Prevention.",2023-09-22 12:00:31+00:00
309,Joe Biden,"RT @POTUS: Last time there was a government shutdown, 800,000 Americans were furloughed or worked without pay.

But enjoy your weekend.",2023-09-22 01:14:43+00:00
310,President Biden,"Last time there was a government shutdown, 800,000 Americans were furloughed or worked without pay.

But enjoy your weekend.",2023-09-21 22:51:26+00:00
311,Axios,NEW: Congress is officially heading home for the weekend after House GOP hardliners once again tanked plans to fund the government by the Oct. 1 deadline. https://t.co/LPVm1w2XP2,2023-09-21 18:47:42+00:00
312,Longevity Labs+ USA,"Autophagy is a naturally occurring process in which our cells are detoxed. This process rejuvenates our bodies, so it's no wonder why it is referred to as “the fountain of youth.” Fasting, exercise, and adequate spermidine levels all lead to improved autophagy.",2023-10-06 15:30:00+00:00
313,Joe Biden,"RT @POTUS: Glad to have you back, Mr. President and Mrs. Zelenska. https://t.co/TaRaLkiL8w",2023-09-21 22:44:56+00:00
314,President Biden,"Glad to have you back, Mr. President and Mrs. Zelenska. https://t.co/TaRaLkiL8w",2023-09-21 22:36:05+00:00
315,Joe Biden,"This week, we approved $37 million in debt cancellation for over 1,200 borrowers who were deceived by the University of Phoenix. We won’t stand for colleges taking advantage of hardworking students and borrowers. https://t.co/fV7rRUDT5h",2023-09-21 22:26:05+00:00
316,Joe Biden,"RT @POTUS: Two nations. One clear, firm, and unwavering message: We stand together.

Дві країни. Один чіткий, твердий і непохитний сигнал: ми разом. https://t.co/d5VGFt8nJk",2023-09-21 22:15:37+00:00
317,President Biden,"Two nations. One clear, firm, and unwavering message: We stand together.

Дві країни. Один чіткий, твердий і непохитний сигнал: ми разом. https://t.co/d5VGFt8nJk",2023-09-21 22:10:19+00:00
318,Joe Biden,"Vice President @KamalaHarris and I have treated the climate crisis as an existential threat from the moment we took office.

Last year, I signed into law the largest investment ever to combat the climate crisis and help move the global economy toward a clean energy future.",2023-09-21 18:30:03+00:00
319,Joe Biden,"MAGAnomics does three things:

Cuts taxes for the very wealthy and big corporations.
Cuts Social Security, Medicare, and Medicaid.
Raises costs for families and guts investments in the middle class.

They’re trying to undo the progress we’ve made.",2023-09-21 15:10:54+00:00
320,Joe Biden,"Here are the facts:

There is a choice between Bidenomics and MAGAnomics—growth and the hope we’re building for America, or the lost jobs and raising fears MAGA Republicans gave us a few short years ago.",2023-09-20 22:10:00+00:00
321,Joe Biden,"While Donald Trump takes credit for killing Roe v. Wade and would sign a national abortion ban, we will always fight to protect a woman’s freedom to choose.",2023-09-20 18:30:03+00:00
322,Joe Biden,This is MAGAnomics. https://t.co/ncgGQisUY3,2023-09-20 15:26:11+00:00
323,Joe Biden,We have a duty to lead in this critical moment—and we will. https://t.co/jOFB0j4riI,2023-09-19 23:40:36+00:00
324,Joe Biden,"Let’s be clear: Donald Trump is responsible for ending Roe v. Wade.

And if you vote for him, he’ll go even further. https://t.co/24Xq6s33wv",2023-09-19 21:37:05+00:00
325,Joe Biden,"As the late Representative John Lewis would say, “Democracy is not a state; it is an act.”

I will do everything in my power to protect the right to vote and ensure that every American has a free and fair opportunity to exercise this fundamental liberty.",2023-09-19 17:00:14+00:00
326,Joe Biden,"The right to vote is the foundation of our democracy. With it, anything is possible in America; without it, nothing is. 

On National Voter Registration Day, make sure your voter registration status is up-to-date so your voice can be heard: https://t.co/Hy8C4mJiSk https://t.co/rc0rZaqkoq",2023-09-19 14:00:22+00:00
327,Joe Biden,"For too long, we’ve been exporting jobs. We’re not doing that anymore. 

We’re creating good-paying union jobs and exporting union-made products to the rest of the world. https://t.co/N2PgwfttZS",2023-09-18 15:32:06+00:00
328,Joe Biden,"RT @POTUS: One of the questions I'm always asked is “If you could do anything at all, what would you do?”

My answer: I’d cure cancer.

It’s not just personal – it’s about what’s possible.

That’s why we’re investing $240 million to accelerate new ways to prevent and treat cancer.",2023-09-18 14:42:50+00:00
329,President Biden,"One of the questions I'm always asked is “If you could do anything at all, what would you do?”

My answer: I’d cure cancer.

It’s not just personal – it’s about what’s possible.

That’s why we’re investing $240 million to accelerate new ways to prevent and treat cancer.",2023-09-17 21:00:00+00:00
330,Joe Biden,This is MAGAnomics. https://t.co/mokUDqX0un,2023-09-17 15:23:21+00:00
331,Joe Biden,The rise reported in child poverty is no accident—it is the result of a deliberate policy choice congressional Republicans made to block help for families with children while advancing massive tax cuts for the wealthiest and largest corporations. https://t.co/8CQ0Q35Mtd,2023-09-16 21:00:08+00:00
332,Joe Biden,"We now have immunizations for all three major seasonal respiratory viruses—COVID-19, flu, and RSV. 

I encourage all Americans to stay up-to-date on their vaccines.
https://t.co/l9SnrQeUu1",2023-09-16 18:16:00+00:00
333,Joe Biden,"We’re continuing to build an economy from the middle out and bottom up, with better jobs and lower costs—even as Republicans in Congress push for tax cuts for the wealthy and large corporations and devastating cuts to Social Security and Medicare.",2023-09-16 15:03:00+00:00
334,Joe Biden,"RT @POTUS: After negotiations broke down, the UAW announced a targeted strike at a few Big 3 auto plants.

No one wants a strike, but I respect workers' right to collective action.

Workers deserve to share in the benefits they helped create for an enterprise. https://t.co/zlnvnYVvao",2023-09-15 21:19:05+00:00
335,President Biden,"After negotiations broke down, the UAW announced a targeted strike at a few Big 3 auto plants.

No one wants a strike, but I respect workers' right to collective action.

Workers deserve to share in the benefits they helped create for an enterprise. https://t.co/zlnvnYVvao",2023-09-15 20:59:33+00:00
336,Joe Biden,Here’s what MAGAnomics is all about. https://t.co/ECHcWXmjWV,2023-09-15 20:30:09+00:00
337,VisualChase,These clever tips prove we don't need a big budget to make a big difference in our organization and interior decor.,2023-12-01 00:21:04+00:00
338,Temu,Discover amazing deals with free shipping on Temu,2023-11-30 13:26:49+00:00
339,Bronxton,Exceptionally soft. Undeniable fit. Thermals for leaders.,2023-11-30 21:29:33+00:00
340,Joe Biden,"The contrast is clear, folks. https://t.co/ZtTkS9GAvP",2023-09-15 17:06:18+00:00
341,Joe Biden,"RT @POTUS: Jill and I extend our warmest wishes to all those celebrating Rosh Hashanah in the United States, Israel, and around the world.
 
May we all be inscribed in the Book of Life. And may it be a happy, healthy, and sweet New Year.
 
Shana Tovah U’Metukah. https://t.co/r3RBCgrTJo",2023-09-15 15:04:46+00:00
342,President Biden,"Jill and I extend our warmest wishes to all those celebrating Rosh Hashanah in the United States, Israel, and around the world.
 
May we all be inscribed in the Book of Life. And may it be a happy, healthy, and sweet New Year.
 
Shana Tovah U’Metukah. https://t.co/r3RBCgrTJo",2023-09-15 14:30:27+00:00
343,Joe Biden,"I’ll ask you nicely to buy this new, color-changing campaign mug. 

But I know someone who won’t: https://t.co/iRL1DMxYAb https://t.co/gTaeXNERbS",2023-09-15 13:30:01+00:00
344,Joe Biden,"RT @POTUS: Hispanic history is American history.
 
It's a history that beats in the soul of our nation — and no where is the power of possibilities more evident than in the Hispanic community in the United States. https://t.co/fvqHkJlh6l",2023-09-15 12:42:59+00:00
345,President Biden,"Hispanic history is American history.
 
It's a history that beats in the soul of our nation — and no where is the power of possibilities more evident than in the Hispanic community in the United States. https://t.co/fvqHkJlh6l",2023-09-15 12:34:38+00:00
346,Joe Biden,The difference between Bidenomics and MAGAnomics. https://t.co/rl3DJOCqpR,2023-09-14 23:42:05+00:00
347,Joe Biden,"MAGAnomics:
—Tax cuts for the wealthy and big corporations
—Cuts Social Security and Medicare
—Raises costs for the middle class

Bidenomics:
—Making the wealthy and big corporations begin to pay their fair share
—Protecting Social Security and Medicare
—Lowering costs",2023-09-14 19:46:00+00:00
348,Joe Biden,Every single one. https://t.co/DVsSPgMLHX,2023-09-14 18:00:19+00:00
349,Joe Biden,"You can’t have the strongest economy in the world with second-rate infrastructure.

That’s why we’re investing in America’s roads, bridges, ports, airports, clean water, high-speed Internet, and so much more.",2023-09-14 16:35:24+00:00
350,Joe Biden,"Unlike the last guy, I won’t stop fighting to end gun violence. https://t.co/DJClxJBZxz",2023-09-13 22:34:05+00:00
351,Joe Biden,"Twenty-nine years ago, we passed the Violence Against Women Act—one of my proudest achievements. In the years since, the law has saved countless lives and helped change the culture around abuse and assault.

We’ve made important progress—but we have more work to do building a society where everyone can thrive without fear of violence or abuse.",2023-09-13 14:02:11+00:00
352,Joe Biden,"RT @POTUS: Today, @CDCgov and @US_FDA authorized, approved, and recommended Americans 6 months and up get an updated COVID-19 vaccine.

Schedule your updated COVID-19 vaccine, flu shot, and RSV shot to stay healthy and protect those around you this fall and winter. https://t.co/tw0IvqAIbp",2023-09-13 00:01:41+00:00
353,President Biden,"Today, @CDCgov and @US_FDA authorized, approved, and recommended Americans 6 months and up get an updated COVID-19 vaccine.

Schedule your updated COVID-19 vaccine, flu shot, and RSV shot to stay healthy and protect those around you this fall and winter. https://t.co/tw0IvqAIbp",2023-09-12 23:30:02+00:00
354,Joe Biden,"Unions raise workers’ incomes, increase homeownership, retirement savings, access to critical benefits like sick leave and child care, and reduce inequality—all of which strengthen the American economy.",2023-09-12 21:40:01+00:00
355,Joe Biden,We're going to transition to an electric vehicle future made in America—and it will protect and expand good union jobs.,2023-09-12 16:28:12+00:00
356,Joe Biden,"RT @POTUS: September 11 is a day not only to remember, but a day of renewal and resolve for every American — in our devotion to this country, to the principles it embodies, to our democracy.
 
That is what we owe one another. 
 
And what we owe future generations of Americans to come. https://t.co/EeCYvo7Q0Q",2023-09-11 16:55:32+00:00
357,President Biden,"September 11 is a day not only to remember, but a day of renewal and resolve for every American — in our devotion to this country, to the principles it embodies, to our democracy.
 
That is what we owe one another. 
 
And what we owe future generations of Americans to come. https://t.co/EeCYvo7Q0Q",2023-09-11 11:46:11+00:00
358,Joe Biden,"RT @POTUS: Today, we remember the 2,977 precious lives stolen from us on 9/11 and reflect on all that was lost in the fire and ash that September morning.

The American story itself changed on this day 22 years ago. But what could not — and will not — change is the character of this nation. https://t.co/qYRfyquQxV",2023-09-11 13:09:03+00:00
359,President Biden,"Today, we remember the 2,977 precious lives stolen from us on 9/11 and reflect on all that was lost in the fire and ash that September morning.

The American story itself changed on this day 22 years ago. But what could not — and will not — change is the character of this nation. https://t.co/qYRfyquQxV",2023-09-11 12:30:01+00:00
360,Joe Biden,"The rate of Americans without health insurance is at an all-time low. 

Premiums for coverage for millions of Americans under the Affordable Care Act are $800 lower per person than before I took office.",2023-09-10 21:10:00+00:00
361,VisualChase,These clever tips prove we don't need a big budget to make a big difference in our organization and interior decor.,2023-12-01 00:31:04+00:00
362,Joe Biden,"We’re protecting pensions for millions of union workers—one of the most significant achievements for union workers and retirees in over 50 years.

And we got it done without a single Republican vote.",2023-09-10 15:53:00+00:00
363,Joe Biden,"All I hear from my friends on the other side of the aisle is what they say is wrong with America.

I’ve got news for them: America has the strongest economy in the world right now and the lowest inflation rate among any major economy.",2023-09-09 23:38:00+00:00
364,Joe Biden,America is in the manufacturing business again—thanks to Bidenomics. https://t.co/PIV1zwsYMI,2023-09-09 20:01:24+00:00
365,Joe Biden,"From day one, I have delivered on the most ambitious climate and conservation agenda in our country’s history. But there is more to do, and we will continue to take bold action to meet the urgency of the climate crisis and to protect our lands and waters for generations to come.",2023-09-09 16:37:00+00:00
366,Temu,Enjoy the best deal and free shipping on your first order.,2023-11-29 14:24:30+00:00
367,Joe Biden,"RT @POTUS: Ready for a productive day two in India, Mr. Prime Minister. https://t.co/9Ll9WPNeMs",2023-09-09 14:07:55+00:00
368,President Biden,"Ready for a productive day two in India, Mr. Prime Minister. https://t.co/9Ll9WPNeMs",2023-09-09 13:50:21+00:00
369,Joe Biden,"The CHIPS and Science Act is a key part of my Bidenomics agenda to bring manufacturing and opportunity to every corner of the country. It’s growing our economy to benefit American union workers, small businesses, and families. https://t.co/ML7BvkdIdF",2023-09-08 23:52:05+00:00
370,Joe Biden,"Decades of handing out excessive tax cuts to the rich and corporations without making investments in America was a bust.

We’re replacing trickle-down economics with Bidenomics—and it's working. https://t.co/1xNDdrLXZM",2023-09-08 19:00:19+00:00
371,Joe Biden,"Under my predecessor, “Infrastructure Week” became a punchline. 

On my watch, we’re investing in America, and we’ve entered an infrastructure decade.",2023-09-08 16:30:05+00:00
372,Joe Biden,This is Bidenomics in action. https://t.co/SupmAZg3nO,2023-09-08 01:30:16+00:00
373,Joe Biden,"RT @POTUS: I’m headed to the G20 – the premier forum for international economic cooperation – focused on making progress on Americans' priorities, delivering for developing nations, and showing our commitment to the G20 as a forum that can deliver. 
 
Every time we engage, we get better.",2023-09-08 00:46:32+00:00
374,President Biden,"I’m headed to the G20 – the premier forum for international economic cooperation – focused on making progress on Americans' priorities, delivering for developing nations, and showing our commitment to the G20 as a forum that can deliver. 
 
Every time we engage, we get better.",2023-09-08 00:05:00+00:00
375,Joe Biden,"When put into practice, trickle-down economics failed. 

It blew up the deficit, increased inequity, and weakened the infrastructure of America. 

Bidenomics is about growing the economy by strengthening the middle class and making things in America again.",2023-09-07 22:14:00+00:00
376,Joe Biden,"We’re canceling all remaining oil and gas leases issued under the previous administration in the Arctic Refuge and protecting more than 13 million acres in the Western Arctic. 

As the climate crisis warms the Arctic, we have a responsibility to protect this treasured region for all ages.",2023-09-07 20:01:32+00:00
377,Joe Biden,I’m proud to stand for democracy—and I won’t back down to dictators. https://t.co/NyQe6JJxhi,2023-09-07 16:12:42+00:00
378,Joe Biden,"Lowering prescription drug costs is part of a much broader vision for our country: growing the economy from the middle out and the bottom up, not from the top down.",2023-09-06 23:00:07+00:00
379,Joe Biden,"The last guy didn’t build a damn thing. 

We are. https://t.co/bQTS96YLuW",2023-09-06 19:55:06+00:00
380,Joe Biden,That’s Bidenomics. https://t.co/xGVpZrvKYN,2023-09-06 15:11:23+00:00
381,Joe Biden,"Over 340,000 veteran survivors are already benefiting from the PACT Act just one year after it was signed. Veterans are getting the care they deserve in every corner of the country.",2023-09-06 00:36:00+00:00
382,Joe Biden,Couldn’t agree more. https://t.co/2l4zAOx7X1,2023-09-05 22:02:23+00:00
383,Joe Biden,"Any person willing to work hard should be able to get a job, raise their kids on a good paycheck, and keep their roots where they grew up.",2023-09-05 20:42:00+00:00
