,Name,Text,Time
794,Joe Biden,"RT @POTUS: Earlier this evening, Speaker McCarthy and I reached a budget agreement in principle.
 
It is an important step forward that reduces spending while protecting critical programs for working people and growing the economy for everyone. And, the agreement protects my and Congressional Democrats’ key priorities and legislative accomplishments.
 
The agreement represents a compromise, which means not everyone gets what they want. That’s the responsibility of governing.
 
And, this agreement is good news for the American people, because it prevents what could have been a catastrophic default and would have led to an economic recession, retirement accounts devastated, and millions of jobs lost.
 
Over the next day, our negotiating teams will finalize legislative text and the agreement will go to the United States House and Senate. I strongly urge both chambers to pass the agreement right away.",2023-05-28 02:00:48+00:00
795,President Biden,"Earlier this evening, Speaker McCarthy and I reached a budget agreement in principle.
 
It is an important step forward that reduces spending while protecting critical programs for working people and growing the economy for everyone. And, the agreement protects my and Congressional Democrats’ key priorities and legislative accomplishments.
 
The agreement represents a compromise, which means not everyone gets what they want. That’s the responsibility of governing.
 
And, this agreement is good news for the American people, because it prevents what could have been a catastrophic default and would have led to an economic recession, retirement accounts devastated, and millions of jobs lost.
 
Over the next day, our negotiating teams will finalize legislative text and the agreement will go to the United States House and Senate. I strongly urge both chambers to pass the agreement right away.",2023-05-28 01:59:30+00:00
796,Joe Biden,"When young people ask what makes me hopeful for future generations, the answer is simple.

It’s you. https://t.co/KLruBh2Wjq",2023-05-27 21:26:05+00:00
797,Joe Biden,"How many more parents must live their worst nightmare before we stand up to the gun lobby to establish universal background checks, national red flag laws, require safe storage of firearms, and end immunity from liability for gun manufacturers? https://t.co/YJPs12zI6F",2023-05-27 16:08:06+00:00
798,Joe Biden,"RT @POTUS: Right now, antisemitic incidents are at a record high in America.
 
It's despicable. And silence is complicity.
 
Under my presidency, we’ll continue to condemn hate wherever it rears its head, including by putting forward the first-ever national strategy to combat antisemitism. https://t.co/gMwK6uXYsE",2023-05-27 01:12:04+00:00
799,President Biden,"Right now, antisemitic incidents are at a record high in America.
 
It's despicable. And silence is complicity.
 
Under my presidency, we’ll continue to condemn hate wherever it rears its head, including by putting forward the first-ever national strategy to combat antisemitism. https://t.co/gMwK6uXYsE",2023-05-27 00:00:00+00:00
800,Joe Biden,Assault weapons have been used time and again in mass killings of innocent children and people. It’s time for Congress to ban them.,2023-05-26 20:15:02+00:00
801,Joe Biden,"Since I’ve been in office, we’ve seen 10.5 million new small business applications—the highest two years on record. 

They’re the engine of our economy, the soul of our communities, and one of the best investments America can make. https://t.co/tlchzvxx1N",2023-05-26 17:08:06+00:00
802,Joe Biden,"We’re proposing a new rule to make it mandatory for all U.S. airlines to compensate you with meals, hotels, taxis, rebooking fees, and cash miles or travel vouchers when they’re the ones to blame for cancellation or delay.

It matters for hardworking families. https://t.co/JXBv6XaQCr",2023-05-26 14:54:08+00:00
803,Temu,Discover amazing deals with free shipping on Temu,2023-11-30 13:21:30+00:00
804,Joe Biden,"Defaulting on the debt—including trillions incurred under Donald Trump—could mean seniors missing Social Security checks and millions of jobs lost.

It sounds like the head of the Republican Party thinks that’s a price worth paying to elect Republicans. https://t.co/fHbRqviI9j",2023-05-25 23:34:05+00:00
805,Joe Biden,"Trickle-down economics doesn’t work. 

That’s why we’re rebuilding an economy from the bottom up and the middle out.",2023-05-25 21:00:10+00:00
806,Joe Biden,"Guns remain the number one killer of children in America.

It’s time to act. https://t.co/v7JgfN6QTZ",2023-05-25 18:25:26+00:00
807,Joe Biden,"Heads up for travelers this Memorial Day weekend:

We launched https://t.co/Qybz3gXfK9: If your flight was canceled or delayed because of an airline, you can check the dashboard to see how you could be compensated.",2023-05-25 15:45:11+00:00
808,Joe Biden,"RT @POTUS: Today, America mourns the murder of George Floyd three years later.

I'll never forget Gianna Floyd's words: “Daddy changed the world.”

He has – unifying people of every race and generation in peace and with purpose to say: Enough.
 
Hate can never have safe harbor in America. https://t.co/8lrRIkiIMI",2023-05-25 13:53:45+00:00
809,President Biden,"Today, America mourns the murder of George Floyd three years later.

I'll never forget Gianna Floyd's words: “Daddy changed the world.”

He has – unifying people of every race and generation in peace and with purpose to say: Enough.
 
Hate can never have safe harbor in America. https://t.co/8lrRIkiIMI",2023-05-25 13:30:00+00:00
810,Joe Biden,"RT @POTUS: George Floyd’s murder exposed for many what Black and Brown communities have long known and experienced – that we must make a commitment to ensure that America lives up to its founding promise of fair and impartial justice for all.

Today, three years after his murder, let us build on the progress we have made and recommit to changing hearts and minds as well as laws and policies.",2023-05-25 13:35:01+00:00
811,President Biden,"George Floyd’s murder exposed for many what Black and Brown communities have long known and experienced – that we must make a commitment to ensure that America lives up to its founding promise of fair and impartial justice for all.

Today, three years after his murder, let us build on the progress we have made and recommit to changing hearts and minds as well as laws and policies.",2023-05-25 12:49:11+00:00
812,Joe Biden,"No matter what happens, you can hear Ron DeSantis’ agenda loud and clear. https://t.co/5QmgvfiTgQ",2023-05-25 00:30:24+00:00
813,Joe Biden,This link works: https://t.co/9PzIJkseYI,2023-05-24 22:16:07+00:00
814,Joe Biden,"RT @POTUS: It's been a year since Robb Elementary School in Uvalde, Texas turned into another tragedy in America.

A year of missed birthdays.
A year of every day joys – his smile, her laugh – gone.

Today, we mourn the 19 children and two educators stolen from us by gun violence.",2023-05-24 20:37:44+00:00
815,President Biden,"It's been a year since Robb Elementary School in Uvalde, Texas turned into another tragedy in America.

A year of missed birthdays.
A year of every day joys – his smile, her laugh – gone.

Today, we mourn the 19 children and two educators stolen from us by gun violence.",2023-05-24 20:25:00+00:00
816,Joe Biden,"We’ve created over 12 million jobs since we’ve been in office, unemployment matches the lowest level since 1969, and we’re seeing the highest share of working-age people in the workforce since 2008. https://t.co/QZ8bS52ij5",2023-05-23 22:20:05+00:00
817,Joe Biden,"RT @POTUS: I just concluded a productive meeting with Speaker McCarthy about the need to prevent default and avoid a catastrophe for our economy.
 
We reiterated once again that default is off the table and the only way to move forward is in good faith toward a bipartisan agreement.
 
While there are areas of disagreement, the Speaker and I, and his lead negotiators Chairman McHenry and Congressman Graves, and our staffs will continue to discuss the path forward.",2023-05-23 15:40:02+00:00
818,President Biden,"I just concluded a productive meeting with Speaker McCarthy about the need to prevent default and avoid a catastrophe for our economy.
 
We reiterated once again that default is off the table and the only way to move forward is in good faith toward a bipartisan agreement.
 
While there are areas of disagreement, the Speaker and I, and his lead negotiators Chairman McHenry and Congressman Graves, and our staffs will continue to discuss the path forward.",2023-05-23 00:02:58+00:00
819,Joe Biden,"RT @POTUS: Mr. President, what the people of Ukraine are defending and what you've achieved is a matter for the entire world to observe.
 
I speak for America when I say that we're in awe of what you've done so far. https://t.co/uPKsTXAJW0",2023-05-21 23:45:44+00:00
820,President Biden,"Mr. President, what the people of Ukraine are defending and what you've achieved is a matter for the entire world to observe.
 
I speak for America when I say that we're in awe of what you've done so far. https://t.co/uPKsTXAJW0",2023-05-21 22:15:01+00:00
821,Joe Biden,"RT @POTUS: MAGA House Republicans are threatening a default that could cost us millions of jobs and trigger a recession.
 
All because they are demanding deep cuts that will hurt hardworking families – even while they protect tax breaks for the wealthy and corporations.

I’ve got a plan to continue reducing the deficit – if only they’d listen.",2023-05-21 21:09:45+00:00
822,President Biden,"MAGA House Republicans are threatening a default that could cost us millions of jobs and trigger a recession.
 
All because they are demanding deep cuts that will hurt hardworking families – even while they protect tax breaks for the wealthy and corporations.

I’ve got a plan to continue reducing the deficit – if only they’d listen.",2023-05-21 16:06:43+00:00
823,Joe Biden,RT @POTUS: The G7 is more united than ever. https://t.co/ZEcyPpdr21,2023-05-20 14:14:00+00:00
824,President Biden,The G7 is more united than ever. https://t.co/ZEcyPpdr21,2023-05-19 23:30:00+00:00
825,Joe Biden,"I'm proud of the progress we have made. 

We reduced the deficit in our first two years by $1.7 trillion. That includes more revenue by asking the wealthy and large corporations to begin to pay their fair share and cutting subsidies to Big Oil and Big Pharma. https://t.co/p6Y4cZWYTe",2023-05-18 22:07:05+00:00
826,Joe Biden,RT @POTUS: I’m confident that Congressional leaders and I will reach an agreement on the budget and that America won’t default. https://t.co/uTxYbu0iI3,2023-05-18 14:51:02+00:00
827,President Biden,I’m confident that Congressional leaders and I will reach an agreement on the budget and that America won’t default. https://t.co/uTxYbu0iI3,2023-05-18 01:45:00+00:00
828,Joe Biden,"Made a surprise visit to @EMILYsList to thank everyone for leading on the critical fight for women’s rights.

It’s about freedom. It’s about democracy. There is too much at stake to sit this out. https://t.co/rkyMyuMTAb",2023-05-18 01:30:07+00:00
829,Joe Biden,"To this year's Medal of Valor recipients:

Your bravery is inspiring. 

You have gone above and beyond the call of duty, exhibiting exceptional courage, and extraordinary decisiveness, regardless of your personal safety, in an attempt to save or protect human life. https://t.co/VRueiHIKIc",2023-05-18 00:00:14+00:00
830,Joe Biden,"Nancy Pelosi is going to go down in history as one of the most consequential speakers in the history of the United States of America. 

When Nancy was speaker, we never had to worry about whether a bill would pass. If she said she had the votes—she had the votes. Every time. https://t.co/AxgvGPjmJ9",2023-05-17 22:16:31+00:00
831,Joe Biden,"We had a productive meeting with congressional leaders yesterday. 

I'm confident that we'll get to an agreement on the budget, and America will not default. Every leader in the room understands the consequences if we fail to pay our bills. https://t.co/hw7RW7Aeu8",2023-05-17 20:31:06+00:00
832,Temu,"More than 1,000,000 items to choose from.",2023-12-01 14:35:13+00:00
833,Joe Biden,"That’s about as clear as it gets. Donald Trump and MAGA Republicans are responsible for killing Roe v. Wade. And if you vote for them, they’ll go even further. https://t.co/IsPEy8pm7M",2023-05-17 19:44:05+00:00
834,Joe Biden,"My plan cuts wasteful spending on Big Oil and Big Pharma. 

MAGA Republicans’ bill cuts veterans’ health care, Meals on Wheels, and education. They’re showing us their values—loud and clear.",2023-05-16 13:58:00+00:00
835,Joe Biden,Students and educators deserve better than this. https://t.co/SDVXScLNL5,2023-05-15 19:45:08+00:00
836,Christmasy,"🧓✏️ GRANDPARENT ALERT ✔️ Reusable Design ✔️ Easy Way to Learn Math, Calligraphy, Motor Skills And More! Get Yours Today ➡️ 
https://t.co/5WjvSgHYGy",2023-12-01 02:31:51+00:00
837,Joe Biden,"We passed the PACT Act to help millions of veterans who were exposed to toxic substances during their military service.

Now, Republican members of Congress want to cut veterans’ programs, resulting in tens of millions fewer health care visits and putting our progress in danger.",2023-05-15 19:15:02+00:00
838,Joe Biden,"My budget invests in working families by lowering costs on everything from health care to child care.

House Republicans' commitments invest in the biggest corporations and wealthiest Americans.

It's time for us to reward work, not wealth.",2023-05-15 14:57:01+00:00
839,Joe Biden,"How do MAGA Republicans choose to repay those who fought to defend our country?

They are proposing cutting veterans’ health care funding, which would result in as many as 30 million fewer veteran outpatient visits.",2023-05-14 22:47:00+00:00
840,Joe Biden,"We are expanding mental health care for our service members and veterans, to better honor our sacred obligation to the troops we send into harm’s way, and to care for them and their families when they are home.",2023-05-14 16:17:00+00:00
841,Joe Biden,"To moms everywhere, I wish you a happy Mother's Day.",2023-05-14 14:10:01+00:00
842,Joe Biden,Investing in America is the core of our work to build our economy from the middle out and the bottom up. https://t.co/d9m57doeKe,2023-05-14 00:10:06+00:00
843,Joe Biden,To the Class of 2023: you are the reason I have never been more optimistic about the future of America. https://t.co/qY9L7oyXXY,2023-05-13 23:15:31+00:00
844,Joe Biden,"I’m proud to say we’ve created 800,000 manufacturing jobs on my watch.

Meanwhile, this is what House Republicans voted for. https://t.co/2qSfCwYvyd",2023-05-13 19:35:05+00:00
845,Joe Biden,"We should be honoring our veterans’ service and sacrifice.

Instead, MAGA Republicans want to make the largest cut to VA benefits in history so the super-wealthy can cheat on their taxes.",2023-05-13 17:42:00+00:00
846,Joe Biden,"We’re proposing a new rule later this year to make it mandatory for all U.S. airlines to compensate you with meals, hotels, taxis, rebooking fees, and cash miles or travel vouchers when they’re the ones to blame for cancellation or delay.

It matters for hardworking families. https://t.co/RctePSK8pq",2023-05-13 01:36:05+00:00
847,Joe Biden,"The last thing this country needs is a manufactured crisis.

But MAGA Republicans are creating exactly that by holding America’s economy hostage—all to try to force cuts to veterans’ benefits, education, health care, and more.",2023-05-12 22:38:00+00:00
848,Joe Biden,"We kept our promise to put the first Black woman on the Supreme Court, and we’ve appointed more Black women to the federal circuit courts than all previous presidents combined—and we’re not done yet. https://t.co/gOqUTTbW5W",2023-05-12 21:53:05+00:00
849,Joe Biden,"I increased the VA’s budget because too many veterans couldn’t get appointments.

The MAGA Republican budget would cut 30 million veterans' health care visits.",2023-05-12 19:55:02+00:00
850,Joe Biden,"We’ve created 12.7 million jobs—nearly 800,000 new manufacturing jobs.
Unemployment is at a 50-year low.
Workforce participation is at its highest in 15 years.

We're building an economy that leaves no one behind. https://t.co/LLG8PiE3Ms",2023-05-12 15:37:06+00:00
851,Joe Biden,While voting to make it easier for the rich to cheat on their taxes. https://t.co/BQJ1XTIDXG,2023-05-12 00:29:05+00:00
852,Joe Biden,My priorities yesterday were a little different from Donald Trump’s. https://t.co/H5toYPzZs5,2023-05-11 22:14:57+00:00
853,Joe Biden,"MAGA Republicans in Congress proposed budget cuts that would threaten veterans' housing services, medical care, and mental health care.

That could result in 30 million fewer veteran outpatient visits.

My budget honors our sacred obligation to care for our veterans.",2023-05-11 18:21:47+00:00
854,Temu,"Outdoor Sale: Hurry, Limited Stock",2023-12-01 14:24:22+00:00
855,Joe Biden,"There were not fine people on both sides of Charlottesville. 

The January 6th rioters were not good people. 

End of story. https://t.co/1Jc9yQwTvh",2023-05-11 01:39:45+00:00
856,Joe Biden,"It’s simple, folks.

Do you want four more years of that?

If you don’t, pitch in to our campaign.
https://t.co/EwCflbYn22",2023-05-11 01:13:14+00:00
857,Joe Biden,"We have a sacred obligation to care for our veterans.

But MAGA Republicans seem to think differently. They’re proposing cuts that threaten veterans’ medical care, housing services, mental health care, and more.

All to help the super-wealthy cheat on their taxes.",2023-05-10 20:16:00+00:00
858,Joe Biden,"A record number of Americans have signed up for coverage through the Affordable Care Act on my watch.

Meanwhile, this is what House Republicans voted for. https://t.co/awttinprNq",2023-05-10 19:10:07+00:00
859,Joe Biden,"Reminder: Under the previous president, Republicans voted to increase the debt limit three times. 

Three times.",2023-05-10 16:50:02+00:00
860,Joe Biden,"I know how frustrating flight delays, cancellations, and rebookings are for travelers.

That’s why we launched https://t.co/Qybz3gXfK9: If your flight was canceled or delayed because of an airline, you can check the dashboard to see how you should be compensated.",2023-05-10 14:30:07+00:00
861,Joe Biden,We have a few new folks joining the team to help get our message out across the country. You’ll be hearing a lot more from them soon — let’s finish the job! https://t.co/XXmIDsKkFv,2023-05-10 12:00:55+00:00
862,Joe Biden,"Inflation is now down 40% since last summer, and it's come down the last nine months in a row. We have more work to do, but we're trending in the right direction, and we're making real progress.",2023-05-09 23:38:00+00:00
863,Joe Biden,"We ask so much of our nation's teachers: early mornings greeting students, late nights grading papers, and more. 

The impact they have is profound.

It's not enough to give teachers praise. 
We need to give them a raise. https://t.co/ryHcIvGn7C",2023-05-09 18:49:05+00:00
864,Joe Biden,"I signed the most extensive gun safety legislation in 30 years, but there’s still more to do. 

When I was a senator, I led the fight to pass the assault weapons ban. Congress must take action to ban them from our streets once again.",2023-05-09 16:15:08+00:00
865,Joe Biden,"A year ago, almost no major airline guaranteed any compensation for delays and cancellations beyond the price of the ticket.

We challenged them to do better. Now, nine major airlines cover hotels. 10 cover meals. 10 rebook for free. That’s real savings for middle class families.",2023-05-09 01:02:00+00:00
866,Joe Biden,This is an insult to all the men and women who fought to protect our freedom. https://t.co/YWOAUdpLVF,2023-05-09 00:15:05+00:00
867,Joe Biden,"The last thing this country needs is to gut education.

But that’s exactly what 217 House Republicans voted to do—their bill could cut up to 60,000 teaching jobs, affecting more than 25 million kids.",2023-05-08 21:39:00+00:00
868,Joe Biden,I proposed a minimum billionaire tax because no billionaire should be paying a lower tax rate than a school teacher or a firefighter.,2023-05-08 19:19:00+00:00
869,Joe Biden,"We’re creating jobs.
We’re lowering costs.

Our plan to grow the economy from the bottom up and middle out is working. https://t.co/8BL5278opZ",2023-05-08 17:09:07+00:00
870,Joe Biden,"As the proud husband of an educator, I've seen the selflessness and dedication of our teachers firsthand.

Teaching isn't just what @DrBiden does; it's who she is. During Teacher Appreciation Week, I'm honoring Jill and all teachers who work to inspire the next generation. https://t.co/eX0qXcMaYy",2023-05-08 15:00:26+00:00
871,Joe Biden,"MAGA Republicans are laying out two options for us:
 
1. Cut veterans’ benefits, Meals on Wheels, education, and health care.
 
2. Force America to default on its debt.
 
They’re holding the American economy hostage.",2023-05-07 21:42:00+00:00
872,Joe Biden,"RT @POTUS: Once again, Congress must send me a bill banning assault weapons and high-capacity magazines. Enacting universal background checks. Requiring safe storage. Ending immunity for gun manufacturers.
 
I will sign it immediately. We need nothing less to keep our streets safe.",2023-05-07 16:54:09+00:00
873,President Biden,"Once again, Congress must send me a bill banning assault weapons and high-capacity magazines. Enacting universal background checks. Requiring safe storage. Ending immunity for gun manufacturers.
 
I will sign it immediately. We need nothing less to keep our streets safe.",2023-05-07 16:43:02+00:00
874,Joe Biden,"RT @POTUS: Yesterday, an assailant in tactical gear armed with an AR-15 style assault weapon gunned down innocent people in a shopping mall, and not for the first time.
 
Such an attack is too shocking to be so familiar.
 
We need more action, faster to save lives.",2023-05-07 16:53:58+00:00
875,President Biden,"Yesterday, an assailant in tactical gear armed with an AR-15 style assault weapon gunned down innocent people in a shopping mall, and not for the first time.
 
Such an attack is too shocking to be so familiar.
 
We need more action, faster to save lives.",2023-05-07 16:43:01+00:00
876,Joe Biden,"RT @POTUS: Eight Americans, including children, were killed in Allen, Texas yesterday – the latest act of gun violence to devastate our nation.

Jill and I are praying for their families and those critically injured. We're grateful to the first responders who acted quickly and courageously.",2023-05-07 16:53:13+00:00
877,President Biden,"Eight Americans, including children, were killed in Allen, Texas yesterday – the latest act of gun violence to devastate our nation.

Jill and I are praying for their families and those critically injured. We're grateful to the first responders who acted quickly and courageously.",2023-05-07 16:43:01+00:00
878,Joe Biden,"Good news: 

Our economy added 250,000 jobs last month. That's on top of the 12 million jobs we've added since we came into office. The unemployment rate is at the lowest in 50 years, and working-age Americans are participating in the labor force at the highest rate in 15 years. https://t.co/PpdoqQSYnL",2023-05-05 22:43:05+00:00
879,Joe Biden,"House Republicans are holding the economy hostage to try to force cuts to: 

—Health care coverage
—Meals on Wheels
—American manufacturing jobs
—Veterans’ health care
—Education funding

All while making it easier for the rich to cheat on their taxes.",2023-05-05 21:19:01+00:00
880,Joe Biden,"217 House Republicans voted to undermine veterans’ health care.

That’s an insult to all the men and women who fought to protect our freedom.",2023-05-04 18:07:01+00:00
881,Joe Biden,"Speaker McCarthy cut a deal with the extreme MAGA wing of his caucus to strip away health care from millions of Americans, send manufacturing jobs overseas, and undermine veterans’ health care.

All to restore the Trump tax cuts for the wealthiest and corporations.",2023-05-04 01:10:00+00:00
882,Joe Biden,"Every time someone starts a new business, it’s an act of hope. 

A record 10.5 million new business applications were filed in my first two years in office, the largest number ever on record.",2023-05-03 22:36:00+00:00
883,Joe Biden,"We’re going to build an America that’s more fair, more just, and more free. That fills me with optimism. https://t.co/JVZ7HDLX4k",2023-05-03 19:14:06+00:00
884,Joe Biden,We're investing in the backbone of America and building an economy that leaves no one behind. https://t.co/0ApgNOzVvX,2023-05-03 15:30:27+00:00
885,Joe Biden,"America is not a deadbeat nation.

We have never, ever failed to pay our debt. But MAGA Republicans are engaged in reckless hostage-taking by threatening to force America into default. It’s dangerous and wrong.",2023-05-03 00:01:00+00:00
886,Joe Biden,We reduced the cost of insulin from hundreds of dollars a month to $35 a month for anyone on Medicare. Let’s lower prescription drug costs for all Americans.,2023-05-02 22:29:00+00:00
887,Joe Biden,"We passed the CHIPS and Science Act, the most significant investment in manufacturing and research and development in American history. It led to $400 billion in private investment in manufacturing and clean energy, creating tens of thousands of jobs all across America. https://t.co/DyFPQnHhZl",2023-05-02 19:09:06+00:00
888,Joe Biden,"Congress must pass a law restoring Roe v. Wade.

If they do, I will sign it.",2023-05-02 16:07:02+00:00
889,Joe Biden,"When I took office, small businesses were getting crushed and hundreds of thousands were closed. 

So we moved fast. I signed the American Rescue Plan and delivered $450 billion in relief to 6 million small businesses.",2023-05-02 00:55:00+00:00
