,Name,Text,Time
0,Joe Biden,"The new Republican Speaker of the House visited Florida to tour the construction of a new airport terminal that’s going to create thousands of jobs over time.

He voted against the law that made it possible, but now he’s taking credit for it.

As my mother would say, God love them.",2023-12-01 20:26:33+00:00
1,Joe Biden,"Investments we're making spurred by the Inflation Reduction Act are going to communities that historically get left behind. When I took office, I vowed I’d be president for all Americans, and we're delivering on that promise.",2023-12-01 00:30:02+00:00
2,Joe Biden,"Carmel-Ann and Giana, Jill and I had a great time meeting you both. https://t.co/1XUGYZm86p",2023-11-30 20:45:42+00:00
3,Joe Biden,"During my first month in office, I signed an executive order bringing supply chains home to get goods moving again.

Now, our supply chains are stronger than ever with backlogs, bottlenecks, and shipping rates at a 25-year low.",2023-11-30 17:40:01+00:00
4,Joe Biden,"Let me be clear to any corporation that hasn’t brought their prices back down even as inflation has come down: It’s time to stop the price gouging.

Give American consumers a break.",2023-11-30 15:29:00+00:00
5,Joe Biden,We passed the biggest investment in the history of the world to combat climate change without a single Republican vote.,2023-11-29 22:45:01+00:00
6,Joe Biden,"Junk fees can add up to hundreds of dollars, weighing down family budgets and making it harder for a family to pay their bills. 

Over the past two years, we have taken steps to crack down on unfair and deceptive junk fees from concerts, airlines, health care, and more.",2023-11-29 17:45:04+00:00
7,Joe Biden,"Hamas unleashed a terrorist attack because they fear nothing more than Israelis and Palestinians living side by side in peace.
 
To continue down the path of terror, violence, killing, and war is to give Hamas what they seek.

We can’t do that.",2023-11-28 22:00:07+00:00
8,Joe Biden,"A two-state solution is the only way to guarantee the long-term security of both the Israeli and the Palestinian people.

To make sure Israelis and Palestinians alike live in equal measure of freedom and dignity, we will not give up on working towards that goal.",2023-11-28 00:05:00+00:00
9,Joe Biden,"Yesterday, 13 more hostages were released, including an American girl named Abigail, who just turned four years old. 

She spent that birthday—and at least 50 days—held hostage by Hamas.

We will not stop working until every hostage is returned to their loved ones.",2023-11-27 21:26:00+00:00
10,Joe Biden,"RT @POTUS: Today, 13 more hostages – including a fellow American – were released by Hamas under a deal brokered and sustained through intensive U.S. diplomacy. 

We continue to press that additional Americans be released. 

And we will not stop working until every hostage is returned. https://t.co/stRApNxMEE",2023-11-26 18:16:29+00:00
11,President Biden,"Today, 13 more hostages – including a fellow American – were released by Hamas under a deal brokered and sustained through intensive U.S. diplomacy. 

We continue to press that additional Americans be released. 

And we will not stop working until every hostage is returned. https://t.co/stRApNxMEE",2023-11-26 18:15:02+00:00
12,Joe Biden,"Small businesses are the engine of our economy and the heart and soul of our communities.

On Small Business Saturday, I encourage you to support the folks in your community by shopping small. https://t.co/aAMT5YTS89",2023-11-25 15:45:06+00:00
13,Joe Biden,"RT @POTUS: Today, as we celebrate the release of dozens of hostages, we remember all those still being held, renewing our commitment to secure their release.

We won't stop until they're home — I have no higher priority. https://t.co/zp28XuIE3X",2023-11-25 00:20:43+00:00
14,President Biden,"Today, as we celebrate the release of dozens of hostages, we remember all those still being held, renewing our commitment to secure their release.

We won't stop until they're home — I have no higher priority. https://t.co/zp28XuIE3X",2023-11-24 23:35:00+00:00
15,Joe Biden,"RT @POTUS: Since time immemorial, Native communities have passed down rich cultures, knowledge, and ways of life. 

Today, on Native American Heritage Day, we celebrate their contributions – and recommit to championing a better chapter in the story of our Nation-to-Nation relationships. https://t.co/oVZ4kuAVAI",2023-11-24 15:13:00+00:00
16,President Biden,"Since time immemorial, Native communities have passed down rich cultures, knowledge, and ways of life. 

Today, on Native American Heritage Day, we celebrate their contributions – and recommit to championing a better chapter in the story of our Nation-to-Nation relationships. https://t.co/oVZ4kuAVAI",2023-11-24 14:49:11+00:00
17,Joe Biden,"This Thanksgiving, as Jill and I reflect on our nation's many blessings, we are thankful for our brave service members and the first responders who put so much on the line to keep us safe today and every day.",2023-11-23 16:00:32+00:00
18,Joe Biden,"RT @POTUS: From mine to yours – Happy Thanksgiving, America. https://t.co/7o2NhEvBUn",2023-11-23 14:56:43+00:00
19,President Biden,"From mine to yours – Happy Thanksgiving, America. https://t.co/7o2NhEvBUn",2023-11-23 14:37:37+00:00
20,Joe Biden,"RT @POTUS: I welcome the deal to secure the release of hostages taken by Hamas during its brutal assault against Israel on October 7th.

I'm gratified that these brave souls, who have endured an unspeakable ordeal, will be reunited with their families once this deal is fully implemented.",2023-11-22 12:20:55+00:00
21,President Biden,"I welcome the deal to secure the release of hostages taken by Hamas during its brutal assault against Israel on October 7th.

I'm gratified that these brave souls, who have endured an unspeakable ordeal, will be reunited with their families once this deal is fully implemented.",2023-11-22 04:18:29+00:00
22,Joe Biden,"Donald Trump is running for president bragging about how he “killed Roe v. Wade.”

Let’s be clear: The only reason a fundamental right has been stripped away from the American people for the first time in American history is because of Trump.",2023-11-21 21:58:00+00:00
23,Joe Biden,"RT @POTUS: Deaths from fentanyl are an American tragedy that requires global action.

I’m committed to doing everything I can to control this crisis – from expanding prevention, harm reduction, treatment, and recovery, to working with Chinese, Mexican, and Canadian partners to tackle this.",2023-11-21 18:58:56+00:00
24,President Biden,"Deaths from fentanyl are an American tragedy that requires global action.

I’m committed to doing everything I can to control this crisis – from expanding prevention, harm reduction, treatment, and recovery, to working with Chinese, Mexican, and Canadian partners to tackle this.",2023-11-21 18:29:13+00:00
25,Joe Biden,"Both Putin and Hamas are fighting to wipe a neighboring democracy off the map. 

America cannot, and will not, let that happen. For our own national security interests—and for the good of the entire world.
https://t.co/CS2lUg6ZCW",2023-11-21 16:33:00+00:00
26,Joe Biden,"It’s true over here on the campaign side, too. I’ve joined Threads. Follow me there: https://t.co/vhwuw7j0zu. https://t.co/XTdAcxbgEx",2023-11-20 23:55:34+00:00
27,Joe Biden,It was my honor to pardon this year's Thanksgiving turkeys: Liberty and Bell. https://t.co/MpcLYbV9qN,2023-11-20 20:00:36+00:00
28,Joe Biden,Bidenomics is working. https://t.co/mz0eRDilOj,2023-11-20 16:32:11+00:00
29,Joe Biden,"RT @POTUS: First Lady Rosalynn Carter walked her own path, inspiring a nation and the world along the way.

On behalf a grateful nation, we send our love to the entire Carter family and the countless people whose lives are better, fuller, and brighter because of Rosalynn Carter.",2023-11-19 23:57:11+00:00
30,President Biden,"First Lady Rosalynn Carter walked her own path, inspiring a nation and the world along the way.

On behalf a grateful nation, we send our love to the entire Carter family and the countless people whose lives are better, fuller, and brighter because of Rosalynn Carter.",2023-11-19 23:45:00+00:00
31,Joe Biden,"This month, the American people voted to protect our fundamental freedoms like the right to choose.

They voted to protect our democracy.
They voted against the extremism of our opponents.

They voted for the progress that @KamalaHarris and I have been making.",2023-11-19 21:05:01+00:00
32,Joe Biden,"For too long, women have been underrepresented when it comes to health research and the money spent on that research. We’re changing that.

We announced the first-ever White House Initiative on Women’s Health Research, changing how we approach and fund women’s health research. https://t.co/0Js8KBupt9",2023-11-19 16:23:05+00:00
33,Joe Biden,"RT @POTUS: The choices we make today will determine the direction of our future for generations to come.

So, will we relentlessly pursue our vision or allow others to drag the world into danger and division?

America cannot, and will not, let that happen.",2023-11-19 01:13:52+00:00
34,President Biden,"The choices we make today will determine the direction of our future for generations to come.

So, will we relentlessly pursue our vision or allow others to drag the world into danger and division?

America cannot, and will not, let that happen.",2023-11-18 19:23:53+00:00
35,Washington Post Opinions,"The world looks to us to solve the problems of our time, @potus writes in a guest opinion. 

“That is the duty of leadership, and America will lead.” https://t.co/n6iWLNOg8n https://t.co/5dAZDhcvGb",2023-11-18 19:21:50+00:00
36,Joe Biden,I’m proud to be the most pro-union president in American history. https://t.co/z8mjhInL0C,2023-11-18 22:54:21+00:00
37,Joe Biden,"There are more people in the U.S. workforce today than any time in American history. Unemployment has been under 4% for 21 straight months.

There’s more to do, but inflation has come down by 65%, and we now have the lowest inflation rate of any advanced economy in the world. https://t.co/Rr9Wa7THNa",2023-11-18 16:35:05+00:00
38,Joe Biden,RT @POTUS: Last night I signed a bill preventing a government shutdown. It’s an important step but we have more to do. I urge Congress to address our national security and domestic needs — and House Republicans to stop wasting time on extreme bills and honor our bipartisan budget agreement. https://t.co/6Ja5jW4YPR,2023-11-17 12:58:31+00:00
39,President Biden,Last night I signed a bill preventing a government shutdown. It’s an important step but we have more to do. I urge Congress to address our national security and domestic needs — and House Republicans to stop wasting time on extreme bills and honor our bipartisan budget agreement. https://t.co/6Ja5jW4YPR,2023-11-17 12:10:28+00:00
40,Joe Biden,"I’m fighting every day to continue lowering costs for hardworking families so they have more breathing room.

Instead of joining me, Congressional Republicans are fighting to slash taxes for the wealthy and big corporations while standing with Big Pharma.

I won’t let them.",2023-11-16 22:57:00+00:00
41,Joe Biden,"RT @POTUS: Mr. President, we have known each other for a long time.

We have not always agreed. But our meetings are always candid, straightforward, and useful.

Yesterday was no different.

Our nations may be in competition, but that doesn't mean we can't compete responsibly. https://t.co/550epPY91b",2023-11-16 17:38:28+00:00
42,President Biden,"Mr. President, we have known each other for a long time.

We have not always agreed. But our meetings are always candid, straightforward, and useful.

Yesterday was no different.

Our nations may be in competition, but that doesn't mean we can't compete responsibly. https://t.co/550epPY91b",2023-11-16 16:28:04+00:00
43,Joe Biden,"RT @POTUS: I’ve just concluded a day of meetings with President Xi, and I believe they were some of the most constructive and productive discussions we’ve had.

We built on groundwork laid over the past several months of diplomacy between our countries and made important progress. https://t.co/0RT1q0FZHr",2023-11-16 00:14:02+00:00
44,President Biden,"I’ve just concluded a day of meetings with President Xi, and I believe they were some of the most constructive and productive discussions we’ve had.

We built on groundwork laid over the past several months of diplomacy between our countries and made important progress. https://t.co/0RT1q0FZHr",2023-11-16 00:05:00+00:00
45,Joe Biden,You can’t make this stuff up. https://t.co/Az5h8QeHBX,2023-11-15 22:39:05+00:00
46,Joe Biden,"Since I signed the Bipartisan Infrastructure Law, we’ve announced over 37,000 projects in 4,500 communities across the country. And we’re just getting started.",2023-11-15 18:30:05+00:00
47,Joe Biden,"Today marks two years since I signed the Bipartisan Infrastructure Law.

It's a once-in-a-generation investment in our roads, bridges, transportation, clean water systems, high-speed internet access, and it's creating good-paying, union jobs you can raise a family on. https://t.co/rSWK9uDwu9",2023-11-15 16:35:07+00:00
48,Joe Biden,"Under my predecessor, “Infrastructure Week” became a punchline.

On my watch, we got it done. https://t.co/321tJ20wll",2023-11-15 13:50:32+00:00
49,Joe Biden,"My predecessor and much of the MAGA Republican Party still deny that climate change is a problem.

Anyone who willfully denies the impact of climate change is condemning the American people to a very dangerous future.",2023-11-15 01:34:01+00:00
50,Joe Biden,"RT @POTUS: As of today, we’ve helped 22 children undergoing cancer treatment in Gaza travel to continue treatment, and we’ll continue facilitating care for more children outside of Gaza.

This wouldn't have been possible without coordination between the U.S., regional partners, and @StJude.",2023-11-14 22:48:12+00:00
51,President Biden,"As of today, we’ve helped 22 children undergoing cancer treatment in Gaza travel to continue treatment, and we’ll continue facilitating care for more children outside of Gaza.

This wouldn't have been possible without coordination between the U.S., regional partners, and @StJude.",2023-11-14 22:35:01+00:00
52,Joe Biden,"Today, we saw more progress bringing down inflation while maintaining one of the strongest job markets in history.

Annual inflation is now down 65% from its peak, and gas prices are down $1.65 from the peak after Putin’s invasion of Ukraine.",2023-11-14 22:29:04+00:00
53,Temu,Shop on Temu for quality auto products you need.,2023-12-01 14:13:24+00:00
54,Joe Biden,"Today, I am announcing $6 billion in new investments from the Inflation Reduction Act and the Bipartisan Infrastructure Law to make communities more resilient to climate change.",2023-11-14 20:15:02+00:00
55,Joe Biden,"RT @POTUS: I've always believed in the power of research to save lives and ensure Americans get the care they need.

Starting today, the first-ever White House Initiative on Women’s Health Research will work towards that goal, changing how we approach and fund women’s health research. https://t.co/9gEFbtXdBn",2023-11-13 22:30:12+00:00
56,President Biden,"I've always believed in the power of research to save lives and ensure Americans get the care they need.

Starting today, the first-ever White House Initiative on Women’s Health Research will work towards that goal, changing how we approach and fund women’s health research. https://t.co/9gEFbtXdBn",2023-11-13 22:21:11+00:00
57,Joe Biden,"Instead of lower wages, the UAW won record gains. 
Instead of fewer jobs, the UAW won a commitment for thousands more jobs. 
Instead of less involvement and investment, the UAW encouraged American automakers to invest $40 billion in the American auto industry.

It's a big deal. https://t.co/qyz7TbdzmS",2023-11-13 21:15:06+00:00
58,Joe Biden,"Today, we celebrated the Vegas @GoldenKnights on their hard-earned Stanley Cup victory.

They’re proving Vegas sports is one of the best shows in town. https://t.co/3wGkIztDq5",2023-11-13 19:45:07+00:00
59,Joe Biden,"I’m proud to say we’ve reached an important milestone: the confirmation of 150 life-tenured federal judges since I took office. 

All of these men and women are highly qualified, faithful to the rule of law, dedicated to the Constitution, and reflect the diversity that is our country’s strength.",2023-11-13 18:14:48+00:00
60,Joe Biden,"MAGA Republicans in Congress are proposing to slash Amtrak’s budget.

We're trying to make train travel easier, faster, safer, and more reliable. They're trying to make it slower, harder, and less safe. 

You can't make this stuff up.",2023-11-12 23:57:00+00:00
61,Joe Biden,The future of the automobile industry will be made in America by American union workers.,2023-11-12 21:34:00+00:00
62,Joe Biden,"RT @POTUS: Over the course of generations, South Asian Americans have woven Diwali traditions into the fabric of our nation – symbolizing the message of seeking the light of wisdom, love, and unity over the darkness of ignorance, hate, and division.

It’s a message that has helped our nation emerge stronger from the past few difficult years, and matters now more than ever. On this Diwali, may we reflect on the strength of our shared light and embrace the enduring spirit of this holiday and of our nation.

To the more than one billion Hindus, Jains, Sikhs, and Buddhists celebrating in America and around the world, we wish you a happy Diwali.",2023-11-12 15:13:46+00:00
63,President Biden,"Over the course of generations, South Asian Americans have woven Diwali traditions into the fabric of our nation – symbolizing the message of seeking the light of wisdom, love, and unity over the darkness of ignorance, hate, and division.

It’s a message that has helped our nation emerge stronger from the past few difficult years, and matters now more than ever. On this Diwali, may we reflect on the strength of our shared light and embrace the enduring spirit of this holiday and of our nation.

To the more than one billion Hindus, Jains, Sikhs, and Buddhists celebrating in America and around the world, we wish you a happy Diwali.",2023-11-12 14:50:12+00:00
64,Joe Biden,"If you don’t respect our troops, you can’t lead them. https://t.co/vmE2i0TLla",2023-11-11 22:33:00+00:00
65,Joe Biden,"RT @POTUS: Today, we honor the story of our veterans – the story of our nation at its best.

On Veterans Day, let’s recommit to fulfilling our one sacred obligation as a nation: to prepare those we send into harm’s way and care for them and their families when they come home. https://t.co/tLDS4cbjyD",2023-11-11 13:34:24+00:00
66,President Biden,"Today, we honor the story of our veterans – the story of our nation at its best.

On Veterans Day, let’s recommit to fulfilling our one sacred obligation as a nation: to prepare those we send into harm’s way and care for them and their families when they come home. https://t.co/tLDS4cbjyD",2023-11-11 13:29:38+00:00
67,Joe Biden,Republicans in Congress should join me in growing the economy and reducing inflation—rather than making threats to weaken our economy or prioritizing more tax cuts for the wealthy and large corporations over essential programs for hardworking families and our national security.,2023-11-11 00:29:00+00:00
68,Joe Biden,"Folks, it’s official: We’re on the ballot in South Carolina. 

South Carolina launched our campaign to victory in 2020, and I know they’ll do it again. https://t.co/kmc98Qr3Ha",2023-11-10 20:55:36+00:00
69,Joe Biden,"The UAW proved what I’ve always believed: Wall Street didn’t build America. The middle class built America, and unions built the middle class. https://t.co/REJd3psTC6",2023-11-10 19:52:21+00:00
70,Joe Biden,"I joined the picket line and stood shoulder-to-shoulder with the UAW.

My predecessor went to a non-union shop and attacked them. https://t.co/t1LuGZMaFc",2023-11-10 16:40:06+00:00
71,Joe Biden,"UAW workers kept the picket line going for 46 days.

In the end, a deal was reached that set a new standard—over 30% increase in wages, bigger pay increases over the next four and a half years than the last 22 years combined, better retirement security, and more.",2023-11-10 01:20:00+00:00
72,Joe Biden,"My predecessor was willing to cede the future of electric vehicles to China. He said if America invests in electric vehicles, it would drive down wages, destroy jobs, and spell the end of the American automobile industry.

Like almost everything else he said, he's wrong. https://t.co/w8BtTD2RCb",2023-11-09 22:40:21+00:00
73,Joe Biden,"RT @POTUS: For weeks, I've been speaking with Israel’s leaders about the importance of humanitarian pauses in the fighting to get civilians to safety, support the freeing of hostages, and increase the flow of food, water, and medicine into Gaza.

Here's the latest on those conversations:",2023-11-09 22:19:03+00:00
74,President Biden,"For weeks, I've been speaking with Israel’s leaders about the importance of humanitarian pauses in the fighting to get civilians to safety, support the freeing of hostages, and increase the flow of food, water, and medicine into Gaza.

Here's the latest on those conversations:",2023-11-09 22:15:00+00:00
75,Joe Biden,"RT @POTUS: In the first week of Open Enrollment, 1.6 million people have signed up for a plan at https://t.co/gRX1fGFEzj, including 301,000 new consumers – that’s a 50% increase from last year. 

Join them by visiting https://t.co/gRX1fGFEzj today. https://t.co/ZCd9qJ0Mt8",2023-11-09 17:47:02+00:00
76,President Biden,"In the first week of Open Enrollment, 1.6 million people have signed up for a plan at https://t.co/gRX1fGFEzj, including 301,000 new consumers – that’s a 50% increase from last year. 

Join them by visiting https://t.co/gRX1fGFEzj today. https://t.co/ZCd9qJ0Mt8",2023-11-09 17:36:49+00:00
77,Joe Biden,"The extreme and dangerous MAGA Republican agenda is out-of-step with the vast majority of Americans.

We will continue to protect access to reproductive health care and call on Congress to restore the protections of Roe v. Wade in federal law once and for all.",2023-11-08 22:04:00+00:00
78,Joe Biden,"Last night, Ohio voters protected access to reproductive health in their state constitution. 

Ohioans and voters across the country rejected attempts by MAGA Republican elected officials to impose extreme abortion bans that put the health and lives of women in jeopardy. https://t.co/ij71yC8v82",2023-11-08 17:15:08+00:00
79,Temu,Discover amazing deals with free shipping on Temu,2023-11-30 13:26:49+00:00
80,Joe Biden,"Across the country tonight, democracy won and MAGA lost.

Voters vote. Polls don't. Now let's go win next year. Donate to join us:
https://t.co/MTqe9XyGm6",2023-11-08 02:46:09+00:00
81,Joe Biden,"It’s Election Day in states across the country.

You can make a difference in this election. Check https://t.co/Hy8C4mJiSk to confirm your polling place and go vote. https://t.co/1O4Gl3yiUB",2023-11-07 14:00:20+00:00
82,Joe Biden,Our administration has made the largest investment in passenger rail since Amtrak was created 50 years ago. https://t.co/XG1dYYZ6J5,2023-11-07 01:45:06+00:00
83,Joe Biden,"We’ve made record-breaking progress in expanding health care coverage and lowering costs for American families, saving them money and giving more Americans the peace of mind that comes with affordable health insurance.",2023-11-06 23:08:00+00:00
84,Joe Biden,RT @POTUS: Today's historic investment in the Northeast Corridor brings America one step closer to 21st Century rail system. https://t.co/rq6uEvjeTR,2023-11-06 20:51:03+00:00
85,President Biden,Today's historic investment in the Northeast Corridor brings America one step closer to 21st Century rail system. https://t.co/rq6uEvjeTR,2023-11-06 19:32:06+00:00
86,Joe Biden,"RT @POTUS: To the people of Maine:

We mourn with you.
We pray with you.
And we will be with you every step of the way. https://t.co/BCLgM8c94W",2023-11-06 00:23:21+00:00
87,President Biden,"To the people of Maine:

We mourn with you.
We pray with you.
And we will be with you every step of the way. https://t.co/BCLgM8c94W",2023-11-05 22:01:23+00:00
88,Joe Biden,"Whether it's protecting a woman's right to make her own health care decisions, defending voting rights, or standing up for common sense gun safety laws, so much is on the line in Virginia.

Let's keep Virginia and our country moving forward: https://t.co/rqHXR7xuqW. https://t.co/XT9GKxyfXa",2023-11-04 22:27:05+00:00
89,Joe Biden,"The unemployment rate has been below 4% for 21 months in a row, the longest stretch in more than 50 years. 

American workers have achieved these gains while inflation has fallen by 60%, and core inflation is at its lowest level in two years—defying projections.",2023-11-04 22:27:00+00:00
90,Joe Biden,"Too many Americans have lost loved ones or survived the trauma of gun violence.

I know consensus is possible. It's about common sense and reasonable, responsible gun safety measures to protect our children, our families, and our communities.",2023-11-04 20:19:01+00:00
91,Joe Biden,"Bidenomics is about investing in America—including rural America. 

The historic legislation we’ve passed is creating new and better markets and new income streams so that generations of rural Americans can begin to thrive again.",2023-11-04 18:00:05+00:00
